# Table of contents

* [Product Management Knowledge Repository](README.md)
* [PM Knowledge Repository - Context for Claude](CLAUDE.md)
* [ZoomInfo Product Organization - Team Mapping](TEAM-MAPPING.md)
* [GitHub Repository Permissions & Workflow Plan](github-repo-permissions-plan.md)
* [Automation Scripts](.automation/README.md)
* [\_templates](_templates/README.md)
  * [Base Template](_templates/_base.md)
  * [{Agent Name}](_templates/agent-prd.md)
  * [{Title}](_templates/doc.md)
  * [{Quarter} {Year} Learnings Memo - {Your Name}](_templates/learnings-memo.md)
  * [{Title}](_templates/one-pager.md)
  * [{Name}](_templates/person.md)
  * [{Title}](_templates/prd.md)
  * [RFC: {Title}](_templates/rfc.md)
  * [{Title}](_templates/six-pager.md)
  * [{Team Name} Weekly Report](_templates/weekly-report.md)
* [learnings-memos](learnings-memos/README.md)
  * [Product Development Foundational Learnings](learnings-memos/FOUNDATIONAL-LEARNINGS.md)
  * [Q3 2025 Product Organization Learnings - Analysis & Summary](learnings-memos/Q3-2025-LEARNINGS-ANALYSIS-SUMMARY.md)
  * [Q3-2025](learnings-memos/q3-2025/README.md)
    * [DAI-Executive](learnings-memos/q3-2025/dai-executive/README.md)
      * [Quarterly Business Review (QBR)](learnings-memos/Q3-2025/DAI-Executive/2025-q3-learnings-intelligence-team.md)
      * [Q3 2025 Learnings Memo - Q3 2025](learnings-memos/Q3-2025/DAI-Executive/2025-q3-learnings-q3-2025.md)
      * [Quarterly Business Review (QBR): Ops and Analytics](learnings-memos/Q3-2025/DAI-Executive/2025-q3-learnings-unknown-pm.md)
    * [Data](learnings-memos/q3-2025/data/README.md)
      * [Q3 2025 Learnings Memo - Cam Fortin](learnings-memos/Q3-2025/Data/2025-q3-learnings-cam-fortin.md)
      * [Q3 2025 Learnings Memo - Hayden Cowell](learnings-memos/Q3-2025/Data/2025-q3-learnings-hayden-cowell.md)
      * [Q3 2025 Learnings Memo - Heather Ma](learnings-memos/Q3-2025/Data/2025-q3-learnings-heather-ma.md)
      * [Q3 2025 Learnings Memo - Jody Roberts](learnings-memos/Q3-2025/Data/2025-q3-learnings-jody-roberts.md)
      * [Q3 2025 Learnings Memo - John Durst](learnings-memos/Q3-2025/Data/2025-q3-learnings-john-durst.md)
      * [Q3 2025 Learnings Memo - Magnus Herweyer](learnings-memos/Q3-2025/Data/2025-q3-learnings-magnus-herweyer.md)
      * [Q3 2025 Learnings Memo - Peter Overman](learnings-memos/Q3-2025/Data/2025-q3-learnings-peter-overman.md)
      * [Q3 2025 Learnings Memo - Rituparna Das](learnings-memos/Q3-2025/Data/2025-q3-learnings-rituparna-das.md)
    * [GTM-Studio](learnings-memos/q3-2025/gtm-studio/README.md)
      * [Q3 2025 Learnings Memo - Arun V](learnings-memos/Q3-2025/GTM-Studio/2025-q3-learnings-arun-v.md)
      * [Q3 2025 Learnings Memo - Ash Lauricella](learnings-memos/Q3-2025/GTM-Studio/2025-q3-learnings-ash-lauricella.md)
      * [Q3 2025 Learning Memo](learnings-memos/Q3-2025/GTM-Studio/2025-q3-learnings-brahm.md)
      * [Q3 2025 Learnings Memo - Corina Soto](learnings-memos/Q3-2025/GTM-Studio/2025-q3-learnings-corina-soto.md)
      * [Q3 2025 Learnings Memo - Jagan Ramesh](learnings-memos/Q3-2025/GTM-Studio/2025-q3-learnings-jagan-ramesh.md)
      * [Q3 2025 Learnings Memo - Karthik Suresh](learnings-memos/Q3-2025/GTM-Studio/2025-q3-learnings-karthik-suresh.md)
      * [Q3 2025 Learnings Memo - Mohan Sun](learnings-memos/Q3-2025/GTM-Studio/2025-q3-learnings-mohan-sun.md)
      * [Q3 2025 Learnings Memo - Neha](learnings-memos/Q3-2025/GTM-Studio/2025-q3-learnings-neha.md)
      * [Q3 2025 Learnings Memo - Tanvi Vaidya](learnings-memos/Q3-2025/GTM-Studio/2025-q3-learnings-tanvi-vaidya.md)
      * [Q3 2025 Learnings Memo - Tingting Wu](learnings-memos/Q3-2025/GTM-Studio/2025-q3-learnings-tingting-wu.md)
    * [GTM-Workspace](learnings-memos/q3-2025/gtm-workspace/README.md)
      * [Q3 2025 Learnings Memo - Adam Severance Copilot & Workspaces](learnings-memos/Q3-2025/GTM-Workspace/2025-q3-learnings-adam-severance-copilot-workspaces.md)
      * [Q3 2025 Learnings Memo - Ant Cuomo](learnings-memos/Q3-2025/GTM-Workspace/2025-q3-learnings-ant-cuomo.md)
      * [Learnings Memo - David Goulden - Q3 2025](learnings-memos/Q3-2025/GTM-Workspace/2025-q3-learnings-david-goulden.md)
      * [Q3 2025 Learnings Memo - Dylan Halladay](learnings-memos/Q3-2025/GTM-Workspace/2025-q3-learnings-dylan-halladay.md)
      * [Q3 2025 Learnings Memo - Gabe Pirela](learnings-memos/Q3-2025/GTM-Workspace/2025-q3-learnings-gabe-pirela.md)
      * [Q3 2025 Learnings Memo - Harinath Krishnamoorthy](learnings-memos/Q3-2025/GTM-Workspace/2025-q3-learnings-harinath-krishnamoorthy.md)
      * [Q3 2025 Learnings Memo - Sean Walter](learnings-memos/Q3-2025/GTM-Workspace/2025-q3-learnings-sean-walter.md)
    * [Intelligence](learnings-memos/q3-2025/intelligence/README.md)
      * [Q3 2025 Learnings Memo - Lars Vedo](learnings-memos/Q3-2025/Intelligence/2025-q3-learnings-lars-vedo.md)
      * [Q3 2025 Learnings Memo - Rowan Bailey](learnings-memos/Q3-2025/Intelligence/2025-q3-learnings-rowan-bailey.md)
      * [Metric Alignment](learnings-memos/Q3-2025/Intelligence/2025-q3-learnings-unknown-pm.md)
    * [Ops](learnings-memos/q3-2025/ops/README.md)
      * [Q3 2025 Learnings Memo - Brett Jacobs](learnings-memos/Q3-2025/Ops/2025-q3-learnings-brett-jacobs.md)
      * [Q3 2025 Learnings Memo - Caleb](learnings-memos/Q3-2025/Ops/2025-q3-learnings-caleb.md)
      * [Q3 2025 QBR Learnings Memo - Daniel Kong](learnings-memos/Q3-2025/Ops/2025-q3-learnings-daniel-kong.md)
      * [Ken Elwell - Q3 2025 Learnings Memo](learnings-memos/Q3-2025/Ops/2025-q3-learnings-q3-2025-learnings-memo.md)
      * [Q3 2025 Learnings Memo - Sam D](learnings-memos/Q3-2025/Ops/2025-q3-learnings-sam-d.md)
    * [Platform](learnings-memos/q3-2025/platform/README.md)
      * [Q3 2025 Learnings Memo - Aadhitthyaa](learnings-memos/Q3-2025/Platform/2025-q3-learnings-aadhitthyaa.md)
      * [Q3 2025 Learnings Memo - AI Action Credits](learnings-memos/Q3-2025/Platform/2025-q3-learnings-ai-action-credits.md)
      * [Q3 2025 Learnings Memo - Andres Perez](learnings-memos/Q3-2025/Platform/2025-q3-learnings-andres-perez.md)
      * [Q3 2025 Learnings Memo - API](learnings-memos/Q3-2025/Platform/2025-q3-learnings-api.md)
      * [Q3 2025 Learnings Memo - Brannen  Login & Provisioning](learnings-memos/Q3-2025/Platform/2025-q3-learnings-brannen-login-provisioning.md)
      * [Q3 2025 Learnings Memo - Brett Elliot](learnings-memos/Q3-2025/Platform/2025-q3-learnings-brett-elliot.md)
      * [Q3 2025 Learnings Memo - Intent](learnings-memos/Q3-2025/Platform/2025-q3-learnings-intent.md)
      * [Q3 2025 Learnings Memo - Jesse Miller](learnings-memos/Q3-2025/Platform/2025-q3-learnings-jesse-miller.md)
      * [Q3 2025 Learnings Memo - Linda Johannessen](learnings-memos/Q3-2025/Platform/2025-q3-learnings-linda-johannessen.md)
      * [Q3 2025 Learnings Memo - Marc Delurgio GTM Data Platform](learnings-memos/Q3-2025/Platform/2025-q3-learnings-marc-delurgio-gtm-data-platform.md)
      * [Q3 2025 Learnings Memo - Marc Frail Workflows](learnings-memos/Q3-2025/Platform/2025-q3-learnings-marc-frail-workflows.md)
      * [Q3 2025 Learnings Memo - Matt Barnes](learnings-memos/Q3-2025/Platform/2025-q3-learnings-matt-barnes.md)
      * [Q3 2025 Learnings Memo - Menna Rashwan](learnings-memos/Q3-2025/Platform/2025-q3-learnings-menna-rashwan.md)
      * [Q3 2025 Learnings Memo - Moshik Levin](learnings-memos/Q3-2025/Platform/2025-q3-learnings-moshik-levin.md)
      * [Q3 2025 Learnings Memo - Prateek Paikray](learnings-memos/Q3-2025/Platform/2025-q3-learnings-prateek-paikray.md)
      * [Q3 2025 Learnings Memo - Sam Massie](learnings-memos/Q3-2025/Platform/2025-q3-learnings-sam-massie.md)
      * [Q3 2025 Learnings Memo - Sanyog Rai](learnings-memos/Q3-2025/Platform/2025-q3-learnings-sanyog-rai.md)
* [Weekly Reports System](weekly-reports/README.md)
  * [synthesis](weekly-reports/synthesis/README.md)
    * [Product Org Synthesized Operating Report - Week of 6/23](weekly-reports/synthesis/product-executive-report-2025-06-27.md)
    * [Product Executive Intelligence Brief - July 04, 2025](weekly-reports/synthesis/product-executive-report-2025-07-04.md)
    * [Product Executive Intelligence Brief - July 11, 2025](weekly-reports/synthesis/product-executive-report-2025-07-11.md)
    * [Product Executive Intelligence Brief - July 18, 2025](weekly-reports/synthesis/product-executive-report-2025-07-18.md)
    * [Product Executive Intelligence Brief - July 25, 2025](weekly-reports/synthesis/product-executive-report-2025-07-25.md)
    * [Product Executive Intelligence Brief - August 01, 2025](weekly-reports/synthesis/product-executive-report-2025-08-01.md)
    * [Product Executive Intelligence Brief - August 08, 2025](weekly-reports/synthesis/product-executive-report-2025-08-08.md)
    * [Product Executive Intelligence Brief - August 15, 2025](weekly-reports/synthesis/product-executive-report-2025-08-15.md)
    * [Product Executive Intelligence Brief - August 22, 2025](weekly-reports/synthesis/product-executive-report-2025-08-22.md)
    * [Product Executive Intelligence Brief - August 29, 2025](weekly-reports/synthesis/product-executive-report-2025-08-29.md)
    * [Product Executive Intelligence Brief - September 05, 2025](weekly-reports/synthesis/product-executive-report-2025-09-05.md)
    * [Product Executive Intelligence Brief - September 12, 2025](weekly-reports/synthesis/product-executive-report-2025-09-12.md)
    * [Product Executive Intelligence Brief - September 19, 2025](weekly-reports/synthesis/product-executive-report-2025-09-19.md)
    * [Product Executive Intelligence Brief - September 26, 2025](weekly-reports/synthesis/product-executive-report-2025-09-26.md)
    * [Product Executive Intelligence Brief - September 29 - October 3, 2025](weekly-reports/synthesis/product-executive-report-2025-10-03.md)
    * [Product Executive Intelligence Brief - October 6-10, 2025](weekly-reports/synthesis/product-executive-report-2025-10-10.md)
    * [Product Executive Intelligence Brief - October 17, 2025](weekly-reports/synthesis/product-executive-report-2025-10-17.md)
    * [Product Executive Intelligence Brief - October 24, 2025](weekly-reports/synthesis/product-executive-report-2025-10-24.md)
    * [Product Executive Intelligence Brief - October 31, 2025](weekly-reports/synthesis/product-executive-report-2025-10-31.md)
    * [Product Executive Intelligence Brief - November 07, 2025](weekly-reports/synthesis/product-executive-report-2025-11-07.md)
    * [Product Executive Intelligence Brief - November 14, 2025](weekly-reports/synthesis/product-executive-report-2025-11-14.md)
    * [Product Executive Intelligence Brief - November 21, 2025](weekly-reports/synthesis/product-executive-report-2025-11-21.md)
    * [Product Executive Intelligence Brief - December 05, 2025](weekly-reports/synthesis/product-executive-report-2025-12-05.md)
    * [Product Executive Intelligence Brief - December 12, 2025](weekly-reports/synthesis/product-executive-report-2025-12-12.md)
  * [team-reports](weekly-reports/team-reports/README.md)
    * [2025-06-27](weekly-reports/team-reports/2025-06-27/README.md)
      * [Brannen's Team Executive Roundup - 6/27/25](weekly-reports/team-reports/2025-06-27/admin-weekly-report-2025-06-27.md)
      * [Automation Executive Roundup - 6/27/2025](weekly-reports/team-reports/2025-06-27/automation-weekly-report-2025-06-27.md)
      * [Core Data Executive Roundup - Week of 06/23](weekly-reports/team-reports/2025-06-27/core-data-weekly-report-2025-06-27.md)
      * [Data Platform Team Executive Roundup - Week of 6/23/25](weekly-reports/team-reports/2025-06-27/data-platform-weekly-report-2025-06-27.md)
      * [Integrations Team Executive Roundup - Week of 20250623](weekly-reports/team-reports/2025-06-27/integrations-weekly-report-2025-06-27.md)
      * [Intelligence Team Executive Roundup - June 27, 2025](weekly-reports/team-reports/2025-06-27/intelligence-weekly-report-2025-06-27.md)
      * [ZIM Team Executive Roundup - Week of June 27, 2025](weekly-reports/team-reports/2025-06-27/zim-weekly-report-2025-06-27.md)
    * [2025-07-04](weekly-reports/team-reports/2025-07-04/README.md)
      * [Admin Weekly Report - July 04, 2025](weekly-reports/team-reports/2025-07-04/admin-weekly-report-2025-07-04.md)
      * [Automation Executive Roundup - 7/4/2025](weekly-reports/team-reports/2025-07-04/automation-weekly-report-2025-07-04.md)
      * [Apps Executive Roundup - Monday June 30 - Thursday July 3](weekly-reports/team-reports/2025-07-04/copilot-weekly-report-2025-07-04.md)
      * [Core Data Executive Roundup - Week of 06/30 - 07/03](weekly-reports/team-reports/2025-07-04/core-data-weekly-report-2025-07-04.md)
      * [Product DAI Executive Report - Week of June 30th](weekly-reports/team-reports/2025-07-04/dai-weekly-report-2025-07-04.md)
      * [Data Platform Team Executive Roundup - 6/30/25](weekly-reports/team-reports/2025-07-04/data-platform-weekly-report-2025-07-04.md)
      * [Data Team Executive Roundup - Monday June 30 - Thursday July 3](weekly-reports/team-reports/2025-07-04/data-weekly-report-2025-07-04.md)
      * [Business Intelligence Team Executive Roundup - July 3, 2025](weekly-reports/team-reports/2025-07-04/intelligence-weekly-report-2025-07-04.md)
      * [Product Ops Team Executive Roundup - Week of June 30th](weekly-reports/team-reports/2025-07-04/product-ops-weekly-report-2025-07-04.md)
      * [Semantic Data Team Executive Roundup - June 30th - July 3rd 2025](weekly-reports/team-reports/2025-07-04/semantic-data-weekly-report-2025-07-04.md)
      * [ZIM Team Executive Roundup - Week of June 30, 2025](weekly-reports/team-reports/2025-07-04/zim-weekly-report-2025-07-04.md)
    * [2025-07-11](weekly-reports/team-reports/2025-07-11/README.md)
      * [Admin Weekly Report - July 11, 2025](weekly-reports/team-reports/2025-07-11/admin-weekly-report-2025-07-11.md)
      * [Automation Executive Roundup - 7/11/2025](weekly-reports/team-reports/2025-07-11/automation-weekly-report-2025-07-11.md)
      * [Core Data Executive Roundup - Week of 07/07 - 07/11](weekly-reports/team-reports/2025-07-11/core-data-weekly-report-2025-07-11.md)
      * [DAI Weekly Report - July 11, 2025](weekly-reports/team-reports/2025-07-11/dai-weekly-report-2025-07-11.md)
      * [Data Platform Team Executive Roundup - w.o. 7/7/25](weekly-reports/team-reports/2025-07-11/data-platform-weekly-report-2025-07-11.md)
      * [Data Weekly Report - July 11, 2025](weekly-reports/team-reports/2025-07-11/data-weekly-report-2025-07-11.md)
      * [Integrations Executive Roundup - Week of July 7, 2025](weekly-reports/team-reports/2025-07-11/integrations-weekly-report-2025-07-11.md)
      * [Intelligence Team Executive Roundup - July 11, 2025](weekly-reports/team-reports/2025-07-11/intelligence-weekly-report-2025-07-11.md)
      * [Analytics Team Executive Roundup - July 11, 2025](weekly-reports/team-reports/2025-07-11/product-bi-weekly-report-2025-07-11.md)
      * [Product Ops Executive Roundup - July 7-11](weekly-reports/team-reports/2025-07-11/product-ops-weekly-report-2025-07-11.md)
      * [Semantic Data Team Executive Roundup - July 11, 2025](weekly-reports/team-reports/2025-07-11/semantic-data-weekly-report-2025-07-11.md)
      * [ZIM Team Executive Roundup - Week of July 7, 2025](weekly-reports/team-reports/2025-07-11/zim-weekly-report-2025-07-11.md)
    * [2025-07-18](weekly-reports/team-reports/2025-07-18/README.md)
      * [B. Huske's Executive Roundup - 7/14/2025](weekly-reports/team-reports/2025-07-18/admin-weekly-report-2025-07-18.md)
      * [Context Engineering Executive Roundup - July 18, 2025](weekly-reports/team-reports/2025-07-18/context-engineering-weekly-report-2025-07-18.md)
      * [Core Data Executive Roundup - Week of 07/14 - 07/18](weekly-reports/team-reports/2025-07-18/core-data-weekly-report-2025-07-18.md)
      * [DAI Weekly Report - July 18, 2025](weekly-reports/team-reports/2025-07-18/dai-weekly-report-2025-07-18.md)
      * [Data Platform Team Executive Roundup - 7/14/25](weekly-reports/team-reports/2025-07-18/data-platform-weekly-report-2025-07-18.md)
      * [Data Weekly Report - July 18, 2025](weekly-reports/team-reports/2025-07-18/data-weekly-report-2025-07-18.md)
      * [Integrations Team Executive Roundup](weekly-reports/team-reports/2025-07-18/integrations-weekly-report-2025-07-18.md)
      * [Product Ops Team Executive Roundup - July 14, 2025](weekly-reports/team-reports/2025-07-18/product-ops-weekly-report-2025-07-18.md)
      * [Semantic Data Team Executive Roundup - July 18, 2025](weekly-reports/team-reports/2025-07-18/semantic-data-weekly-report-2025-07-18.md)
      * [Anwar's Team Executive Roundup - Week of July 14, 2025](weekly-reports/team-reports/2025-07-18/zim-weekly-report-2025-07-18.md)
    * [2025-07-25](weekly-reports/team-reports/2025-07-25/README.md)
      * [Admin Weekly Report - July 25, 2025](weekly-reports/team-reports/2025-07-25/admin-weekly-report-2025-07-25.md)
      * [Automation Executive Roundup - 7/25/2025](weekly-reports/team-reports/2025-07-25/automation-weekly-report-2025-07-25.md)
      * [Context Engineering Team Executive Roundup - July 25, 2025](weekly-reports/team-reports/2025-07-25/context-engineering-weekly-report-2025-07-25.md)
      * [Core Data Executive Roundup - Week of 07/21 - 07/25](weekly-reports/team-reports/2025-07-25/core-data-weekly-report-2025-07-25.md)
      * [DAI Weekly Report - July 25, 2025](weekly-reports/team-reports/2025-07-25/dai-weekly-report-2025-07-25.md)
      * [Data Platform Team Executive Roundup - 7/21/25](weekly-reports/team-reports/2025-07-25/data-platform-weekly-report-2025-07-25.md)
      * [Data Weekly Report - July 25, 2025](weekly-reports/team-reports/2025-07-25/data-weekly-report-2025-07-25.md)
      * [Integrations Weekly Report - July 25, 2025](weekly-reports/team-reports/2025-07-25/integrations-weekly-report-2025-07-25.md)
      * [Product Ops Executive Roundup - July 21, 2025](weekly-reports/team-reports/2025-07-25/product-ops-weekly-report-2025-07-25.md)
      * [Semantic Data Team Executive Roundup - July 25, 2025](weekly-reports/team-reports/2025-07-25/semantic-data-weekly-report-2025-07-25.md)
      * [ZIM Team Executive Roundup - Week of July 21, 2025](weekly-reports/team-reports/2025-07-25/zim-weekly-report-2025-07-25.md)
    * [2025-08-01](weekly-reports/team-reports/2025-08-01/README.md)
      * [Admin Weekly Report - August 01, 2025](weekly-reports/team-reports/2025-08-01/admin-weekly-report-2025-08-01.md)
      * [Automation Executive Roundup - 8/1/2025](weekly-reports/team-reports/2025-08-01/automation-weekly-report-2025-08-01.md)
      * [Context Engineering Team Executive Roundup - August 1st, 2025](weekly-reports/team-reports/2025-08-01/context-engineering-weekly-report-2025-08-01.md)
      * [DAI Weekly Report - August 01, 2025](weekly-reports/team-reports/2025-08-01/dai-weekly-report-2025-08-01.md)
      * [Data Platform Team Executive Roundup - Week of 7/28/2025](weekly-reports/team-reports/2025-08-01/data-platform-weekly-report-2025-08-01.md)
      * [Data Weekly Report - August 01, 2025](weekly-reports/team-reports/2025-08-01/data-weekly-report-2025-08-01.md)
      * [GTM Studio Roundup - 07/28/2025](weekly-reports/team-reports/2025-08-01/gtm-studio-weekly-report-2025-08-01.md)
      * [GTM Workspace (Copilot) Weekly Report - August 01, 2025](weekly-reports/team-reports/2025-08-01/gtm-workspace-weekly-report-2025-08-01.md)
      * [\[Product Operations\] Executive Roundup - \[7/28-8/1\]](weekly-reports/team-reports/2025-08-01/product-ops-weekly-report-2025-08-01.md)
      * [Semantic Data Weekly Report - August 01, 2025](weekly-reports/team-reports/2025-08-01/semantic-data-weekly-report-2025-08-01.md)
      * [ZIM Team Executive Roundup - Week of July 28, 2025](weekly-reports/team-reports/2025-08-01/zim-weekly-report-2025-08-01.md)
    * [2025-08-08](weekly-reports/team-reports/2025-08-08/README.md)
      * [Admin Weekly Report - August 08, 2025](weekly-reports/team-reports/2025-08-08/admin-weekly-report-2025-08-08.md)
      * [DAI Weekly Report - August 08, 2025](weekly-reports/team-reports/2025-08-08/dai-weekly-report-2025-08-08.md)
      * [M. Delurgio Team Executive Roundup -- August 4--8, 2025](weekly-reports/team-reports/2025-08-08/data-platform-weekly-report-2025-08-08.md)
      * [Data Weekly Report - August 08, 2025](weekly-reports/team-reports/2025-08-08/data-weekly-report-2025-08-08.md)
      * [GTM Studio Roundup - 08/04/2025](weekly-reports/team-reports/2025-08-08/gtm-studio-weekly-report-2025-08-08.md)
      * [GTM Workspace (Copilot) Weekly Report - August 08, 2025](weekly-reports/team-reports/2025-08-08/gtm-workspace-weekly-report-2025-08-08.md)
      * [Integrations Executive Roundup - Week of August 4, 2025](weekly-reports/team-reports/2025-08-08/integrations-weekly-report-2025-08-08.md)
      * [Business Intelligence Team Executive Roundup - August 8, 2025](weekly-reports/team-reports/2025-08-08/intelligence-weekly-report-2025-08-08.md)
      * [Product Marketing Team Executive Roundup - August 8, 2025](weekly-reports/team-reports/2025-08-08/product-marketing-weekly-report-2025-08-08.md)
      * [Product Ops Executive Roundup - August 4-8, 2025](weekly-reports/team-reports/2025-08-08/product-ops-weekly-report-2025-08-08.md)
      * [ZIM Team Executive Roundup - Week of August 4, 2025](weekly-reports/team-reports/2025-08-08/zim-weekly-report-2025-08-08.md)
    * [2025-08-15](weekly-reports/team-reports/2025-08-15/README.md)
      * [Admin Weekly Report - August 15, 2025](weekly-reports/team-reports/2025-08-15/admin-weekly-report-2025-08-15.md)
      * [Automation Executive Roundup - 8/15/2025](weekly-reports/team-reports/2025-08-15/automation-weekly-report-2025-08-15.md)
      * [DAI Weekly Report - August 15, 2025](weekly-reports/team-reports/2025-08-15/dai-weekly-report-2025-08-15.md)
      * [Data Platform Team Executive Roundup - August 15, 2025](weekly-reports/team-reports/2025-08-15/data-platform-weekly-report-2025-08-15.md)
      * [Data Weekly Report - August 15, 2025](weekly-reports/team-reports/2025-08-15/data-weekly-report-2025-08-15.md)
      * [GTM Studio Executive Roundup - 08/15/2025](weekly-reports/team-reports/2025-08-15/gtm-studio-weekly-report-2025-08-15.md)
      * [GTM Workspace (Copilot) Weekly Report - August 15, 2025](weekly-reports/team-reports/2025-08-15/gtm-workspace-weekly-report-2025-08-15.md)
      * [Integrations Executive Roundup - Week of August 11, 2025](weekly-reports/team-reports/2025-08-15/integrations-weekly-report-2025-08-15.md)
      * [Product Ops Executive Roundup - August 15, 2025](weekly-reports/team-reports/2025-08-15/product-ops-weekly-report-2025-08-15.md)
      * [ZIM Team Executive Roundup - Week of August 11, 2025](weekly-reports/team-reports/2025-08-15/zim-weekly-report-2025-08-15.md)
    * [2025-08-22](weekly-reports/team-reports/2025-08-22/README.md)
      * [Admin Weekly Report - August 22, 2025](weekly-reports/team-reports/2025-08-22/admin-weekly-report-2025-08-22.md)
      * [Automation Executive Roundup - 8/22/2025](weekly-reports/team-reports/2025-08-22/automation-weekly-report-2025-08-22.md)
      * [Context Engineering Team Executive Roundup - August 22, 2025](weekly-reports/team-reports/2025-08-22/context-engineering-weekly-report-2025-08-22.md)
      * [DAI Weekly Report - August 22, 2025](weekly-reports/team-reports/2025-08-22/dai-weekly-report-2025-08-22.md)
      * [Data Platform Team Executive Roundup - 8/22/25](weekly-reports/team-reports/2025-08-22/data-platform-weekly-report-2025-08-22.md)
      * [Data Weekly Report - August 22, 2025](weekly-reports/team-reports/2025-08-22/data-weekly-report-2025-08-22.md)
      * [GTM Studio Executive Roundup - 08/22/2025](weekly-reports/team-reports/2025-08-22/gtm-studio-weekly-report-2025-08-22.md)
      * [GTM Workspace (Copilot) Weekly Report - August 22, 2025](weekly-reports/team-reports/2025-08-22/gtm-workspace-weekly-report-2025-08-22.md)
      * [Integrations Weekly Report - August 22, 2025](weekly-reports/team-reports/2025-08-22/integrations-weekly-report-2025-08-22.md)
      * [Intelligence Team Executive Roundup - August 22, 2025](weekly-reports/team-reports/2025-08-22/intelligence-weekly-report-2025-08-22.md)
      * [Product Ops Executive Roundup - 8/22/25](weekly-reports/team-reports/2025-08-22/product-ops-weekly-report-2025-08-22.md)
      * [Semantic Data Team Executive Roundup - August 22, 2025](weekly-reports/team-reports/2025-08-22/semantic-data-weekly-report-2025-08-22.md)
      * [ZIM Team Executive Roundup - Week of August 18, 2025](weekly-reports/team-reports/2025-08-22/zim-weekly-report-2025-08-22.md)
    * [2025-08-29](weekly-reports/team-reports/2025-08-29/README.md)
      * [Admin Weekly Report - August 29, 2025](weekly-reports/team-reports/2025-08-29/admin-weekly-report-2025-08-29.md)
      * [Automation Executive Roundup - 8/29/2025](weekly-reports/team-reports/2025-08-29/automation-weekly-report-2025-08-29.md)
      * [Context Engineering Team Executive Roundup - August 29, 2025](weekly-reports/team-reports/2025-08-29/context-engineering-weekly-report-2025-08-29.md)
      * [DAI Weekly Report - August 29, 2025](weekly-reports/team-reports/2025-08-29/dai-weekly-report-2025-08-29.md)
      * [Data Platform Team Executive Roundup - 8/30/25](weekly-reports/team-reports/2025-08-29/data-platform-weekly-report-2025-08-29.md)
      * [Core Data Executive Roundup - Week of 08/25-08/29](weekly-reports/team-reports/2025-08-29/data-weekly-report-2025-08-29.md)
      * [GTM Studio Executive Roundup - 08/29/2025](weekly-reports/team-reports/2025-08-29/gtm-studio-weekly-report-2025-08-29.md)
      * [GTM Workspace (Copilot) Weekly Report - August 29, 2025](weekly-reports/team-reports/2025-08-29/gtm-workspace-weekly-report-2025-08-29.md)
      * [\[Integrations Executive Roundup - \[8/25/25\]](weekly-reports/team-reports/2025-08-29/integrations-weekly-report-2025-08-29.md)
      * [Product Ops Executive Roundup - August 25, 2025](weekly-reports/team-reports/2025-08-29/product-ops-weekly-report-2025-08-29.md)
      * [Semantic Data Team Executive Roundup - August 29, 2025](weekly-reports/team-reports/2025-08-29/semantic-data-weekly-report-2025-08-29.md)
      * [ZIM Team Executive Roundup - Week of August 25, 2025](weekly-reports/team-reports/2025-08-29/zim-weekly-report-2025-08-29.md)
    * [2025-09-06](weekly-reports/team-reports/2025-09-06/README.md)
      * [B. Huske's Executive Roundup - 9/1/2025](weekly-reports/team-reports/2025-09-06/admin-weekly-report-2025-09-06.md)
      * [Context Engineering Team Executive Roundup - September 5, 2025](weekly-reports/team-reports/2025-09-06/context-engineering-weekly-report-2025-09-06.md)
      * [DAI Weekly Report - September 06, 2025](weekly-reports/team-reports/2025-09-06/dai-weekly-report-2025-09-06.md)
      * [GTM Data Platform Team Executive Roundup - Week of 9/1/2025](weekly-reports/team-reports/2025-09-06/data-platform-weekly-report-2025-09-06.md)
      * [Data Weekly Report - September 06, 2025](weekly-reports/team-reports/2025-09-06/data-weekly-report-2025-09-06.md)
      * [GTM Studio Executive Roundup - September 1-5, 2025](weekly-reports/team-reports/2025-09-06/gtm-studio-weekly-report-2025-09-06.md)
      * [GTM Workspace (Copilot) Weekly Report - September 06, 2025](weekly-reports/team-reports/2025-09-06/gtm-workspace-weekly-report-2025-09-06.md)
      * [Integrations Team Executive Roundup](weekly-reports/team-reports/2025-09-06/integrations-weekly-report-2025-09-06.md)
      * [MCP Team Executive Roundup - September 5th, 2025](weekly-reports/team-reports/2025-09-06/mcp-weekly-report-2025-09-06.md)
      * [Product BI Weekly Report - September 06, 2025](weekly-reports/team-reports/2025-09-06/product-bi-weekly-report-2025-09-06.md)
      * [Product Ops Executive Roundup - September 2, 2025](weekly-reports/team-reports/2025-09-06/product-ops-weekly-report-2025-09-06.md)
      * [Semantic Data Team Executive Roundup - September 5, 2025](weekly-reports/team-reports/2025-09-06/semantic-data-weekly-report-2025-09-06.md)
      * [ZIM Team Executive Roundup - Week of September 1, 2025](weekly-reports/team-reports/2025-09-06/zim-weekly-report-2025-09-06.md)
    * [2025-09-12](weekly-reports/team-reports/2025-09-12/README.md)
      * [Automation Executive Roundup - 9/12/2025](weekly-reports/team-reports/2025-09-12/automation-weekly-report-2025-09-12.md)
      * [Context Engineering Team Executive Roundup - September 12, 2025](weekly-reports/team-reports/2025-09-12/context-engineering-weekly-report-2025-09-12.md)
      * [DAI Weekly Report - September 12, 2025](weekly-reports/team-reports/2025-09-12/dai-weekly-report-2025-09-12.md)
      * [Data Platform Team Executive Roundup - September 8, 2025](weekly-reports/team-reports/2025-09-12/data-platform-weekly-report-2025-09-12.md)
      * [Data Weekly Report - September 12, 2025](weekly-reports/team-reports/2025-09-12/data-weekly-report-2025-09-12.md)
      * [GTM Studio Executive Roundup - September 8-12, 2025](weekly-reports/team-reports/2025-09-12/gtm-studio-weekly-report-2025-09-12.md)
      * [Integrations Team Executive Roundup - Week of September 8, 2025](weekly-reports/team-reports/2025-09-12/integrations-weekly-report-2025-09-12.md)
      * [MCP Team Executive Roundup - September 8-12, 2025](weekly-reports/team-reports/2025-09-12/mcp-weekly-report-2025-09-12.md)
      * [Product BI Weekly Report - September 12, 2025](weekly-reports/team-reports/2025-09-12/product-bi-weekly-report-2025-09-12.md)
      * [Product Ops Executive Roundup - September 8-12, 2025](weekly-reports/team-reports/2025-09-12/product-ops-weekly-report-2025-09-12.md)
      * [Semantic Data Team Executive Roundup - September 8-12, 2025](weekly-reports/team-reports/2025-09-12/semantic-data-weekly-report-2025-09-12.md)
      * [ZIM Team Executive Roundup - Week of September 8, 2025](weekly-reports/team-reports/2025-09-12/zim-weekly-report-2025-09-12.md)
    * [2025-09-19](weekly-reports/team-reports/2025-09-19/README.md)
      * [Context Engineering Team Executive Roundup - September 19, 2025](weekly-reports/team-reports/2025-09-19/context-engineering-weekly-report-2025-09-19.md)
      * [DAI Weekly Report - September 19, 2025](weekly-reports/team-reports/2025-09-19/dai-weekly-report-2025-09-19.md)
      * [Data Platform Team Executive Roundup - September 19, 2025](weekly-reports/team-reports/2025-09-19/data-platform-weekly-report-2025-09-19.md)
      * [Data Weekly Report - September 19, 2025](weekly-reports/team-reports/2025-09-19/data-weekly-report-2025-09-19.md)
      * [GTM Studio Executive Roundup - September 15-19](weekly-reports/team-reports/2025-09-19/gtm-studio-weekly-report-2025-09-19.md)
      * [GTM Workspace (Copilot) Weekly Report - September 19, 2025](weekly-reports/team-reports/2025-09-19/gtm-workspace-weekly-report-2025-09-19.md)
      * [Integrations Weekly Report - September 19, 2025](weekly-reports/team-reports/2025-09-19/integrations-weekly-report-2025-09-19.md)
      * [MCP Team Roundup - September 19th, 2025](weekly-reports/team-reports/2025-09-19/mcp-weekly-report-2025-09-19.md)
      * [Product BI Weekly Report - September 19, 2025](weekly-reports/team-reports/2025-09-19/product-bi-weekly-report-2025-09-19.md)
      * [Product Operations Team Executive Roundup - September 15, 2025](weekly-reports/team-reports/2025-09-19/product-ops-weekly-report-2025-09-19.md)
      * [Semantic Data Team Executive Roundup - September 19, 2025](weekly-reports/team-reports/2025-09-19/semantic-data-weekly-report-2025-09-19.md)
      * [ZIM Team Executive Roundup - Week of September 15, 2025](weekly-reports/team-reports/2025-09-19/zim-weekly-report-2025-09-19.md)
    * [2025-09-26](weekly-reports/team-reports/2025-09-26/README.md)
      * [Context Engineering Team Executive Roundup](weekly-reports/team-reports/2025-09-26/context-engineering-weekly-report-2025-09-26.md)
      * [DAI Weekly Report - September 26, 2025](weekly-reports/team-reports/2025-09-26/dai-weekly-report-2025-09-26.md)
      * [GTM Data Platform Weekly Report - September 26, 2025](weekly-reports/team-reports/2025-09-26/data-platform-weekly-report-2025-09-26.md)
      * [Data Weekly Report - September 26, 2025](weekly-reports/team-reports/2025-09-26/data-weekly-report-2025-09-26.md)
      * [GTM Studio Executive Roundup - September 26, 2025](weekly-reports/team-reports/2025-09-26/gtm-studio-weekly-report-2025-09-26.md)
      * [GTM Workspace (Copilot) Weekly Report - September 26, 2025](weekly-reports/team-reports/2025-09-26/gtm-workspace-weekly-report-2025-09-26.md)
      * [Integrations Executive Roundup - September 22, 2025](weekly-reports/team-reports/2025-09-26/integrations-weekly-report-2025-09-26.md)
      * [Intelligence Weekly Report - September 26, 2025](weekly-reports/team-reports/2025-09-26/intelligence-weekly-report-2025-09-26.md)
      * [MCP Team Executive Roundup - September 26, 2025](weekly-reports/team-reports/2025-09-26/mcp-weekly-report-2025-09-26.md)
      * [Product BI Weekly Report - September 26, 2025](weekly-reports/team-reports/2025-09-26/product-bi-weekly-report-2025-09-26.md)
      * [Product Ops Team Executive Roundup - September 22-26, 2025](weekly-reports/team-reports/2025-09-26/product-ops-weekly-report-2025-09-26.md)
      * [Semantic Data Team Executive Roundup - September 26, 2025](weekly-reports/team-reports/2025-09-26/semantic-data-weekly-report-2025-09-26.md)
      * [ZIM Team Executive Roundup - Week of September 22, 2025](weekly-reports/team-reports/2025-09-26/zim-weekly-report-2025-09-26.md)
    * [2025-10-03](weekly-reports/team-reports/2025-10-03/README.md)
      * [DAI Weekly Report - October 03, 2025](weekly-reports/team-reports/2025-10-03/dai-weekly-report-2025-10-03.md)
      * [Data Platform Team Executive Roundup - September 26, 2025](weekly-reports/team-reports/2025-10-03/data-platform-weekly-report-2025-10-03.md)
      * [Data Weekly Report - October 03, 2025](weekly-reports/team-reports/2025-10-03/data-weekly-report-2025-10-03.md)
      * [GTM Studio Weekly Report - October 03, 2025](weekly-reports/team-reports/2025-10-03/gtm-studio-weekly-report-2025-10-03.md)
      * [GTM Workspace (Copilot) Weekly Report - October 03, 2025](weekly-reports/team-reports/2025-10-03/gtm-workspace-weekly-report-2025-10-03.md)
      * [Integrations Executive Roundup - Week of September 29, 2025](weekly-reports/team-reports/2025-10-03/integrations-weekly-report-2025-10-03.md)
      * [Intelligence Weekly Report - October 03, 2025](weekly-reports/team-reports/2025-10-03/intelligence-weekly-report-2025-10-03.md)
      * [Agent Platform Team Executive Roundup - October 3, 2025](weekly-reports/team-reports/2025-10-03/mcp-weekly-report-2025-10-03.md)
      * [Product BI Weekly Report - October 03, 2025](weekly-reports/team-reports/2025-10-03/product-bi-weekly-report-2025-10-03.md)
      * [Product Marketing Executive Roundup - September 29, 2025](weekly-reports/team-reports/2025-10-03/product-marketing-weekly-report-2025-10-03.md)
      * [Product Ops Executive Roundup - September 29, 2025](weekly-reports/team-reports/2025-10-03/product-ops-weekly-report-2025-10-03.md)
      * [Semantic Data Team Executive Roundup - October 3, 2025](weekly-reports/team-reports/2025-10-03/semantic-data-weekly-report-2025-10-03.md)
      * [ZIM Team Executive Roundup - Week of September 29, 2025](weekly-reports/team-reports/2025-10-03/zim-weekly-report-2025-10-03.md)
    * [2025-10-10](weekly-reports/team-reports/2025-10-10/README.md)
      * [Automation Executive Roundup - 10/10/2025](weekly-reports/team-reports/2025-10-10/automation-weekly-report-2025-10-10.md)
      * [DAI Weekly Report - October 10, 2025](weekly-reports/team-reports/2025-10-10/dai-weekly-report-2025-10-10.md)
      * [Data Platform Executive Roundup - Week of October 6, 2025](weekly-reports/team-reports/2025-10-10/data-platform-weekly-report-2025-10-10.md)
      * [Data Weekly Report - October 10, 2025](weekly-reports/team-reports/2025-10-10/data-weekly-report-2025-10-10.md)
      * [GTM Studio Weekly Report - October 10, 2025](weekly-reports/team-reports/2025-10-10/gtm-studio-weekly-report-2025-10-10.md)
      * [GTM Workspace (Copilot) Weekly Report - October 10, 2025](weekly-reports/team-reports/2025-10-10/gtm-workspace-weekly-report-2025-10-10.md)
      * [Integrations Team Executive Roundup - October 6, 2025](weekly-reports/team-reports/2025-10-10/integrations-weekly-report-2025-10-10.md)
      * [Intelligence Weekly Report - October 10, 2025](weekly-reports/team-reports/2025-10-10/intelligence-weekly-report-2025-10-10.md)
      * [MCP Tiger Team Executive Roundup - October 10, 2025](weekly-reports/team-reports/2025-10-10/mcp-weekly-report-2025-10-10.md)
      * [Product Ops Team Executive Roundup - October 6-10, 2025](weekly-reports/team-reports/2025-10-10/product-ops-weekly-report-2025-10-10.md)
      * [Semantic Data Team Executive Roundup - October 10, 2025](weekly-reports/team-reports/2025-10-10/semantic-data-weekly-report-2025-10-10.md)
      * [ZIM Team Executive Roundup - Week of October 6, 2025](weekly-reports/team-reports/2025-10-10/zim-weekly-report-2025-10-10.md)
    * [2025-10-17](weekly-reports/team-reports/2025-10-17/README.md)
      * [DAI Weekly Report - October 17, 2025](weekly-reports/team-reports/2025-10-17/dai-weekly-report-2025-10-17.md)
      * [GTM Data Platform Executive Roundup - Week of October 13, 2025](weekly-reports/team-reports/2025-10-17/data-platform-weekly-report-2025-10-17.md)
      * [Data Weekly Report - October 17, 2025](weekly-reports/team-reports/2025-10-17/data-weekly-report-2025-10-17.md)
      * [GTM Studio Weekly Report - October 17, 2025](weekly-reports/team-reports/2025-10-17/gtm-studio-weekly-report-2025-10-17.md)
      * [GTM Workspace (Copilot) Weekly Report - October 17, 2025](weekly-reports/team-reports/2025-10-17/gtm-workspace-weekly-report-2025-10-17.md)
      * [Integrations Executive Roundup - Week of October 13, 2025](weekly-reports/team-reports/2025-10-17/integrations-weekly-report-2025-10-17.md)
      * [Intelligence Weekly Report - October 17, 2025](weekly-reports/team-reports/2025-10-17/intelligence-weekly-report-2025-10-17.md)
      * [MCP Tiger Team Executive Roundup - October 13-17, 2025](weekly-reports/team-reports/2025-10-17/mcp-weekly-report-2025-10-17.md)
      * [Product BI Weekly Report - October 17, 2025](weekly-reports/team-reports/2025-10-17/product-bi-weekly-report-2025-10-17.md)
      * [Product Marketing Executive Roundup - October 17, 2025](weekly-reports/team-reports/2025-10-17/product-marketing-weekly-report-2025-10-17.md)
      * [Product Ops Executive Roundup - October 13, 2025](weekly-reports/team-reports/2025-10-17/product-ops-weekly-report-2025-10-17.md)
      * [Semantic Data Team Executive Roundup - October 17, 2025](weekly-reports/team-reports/2025-10-17/semantic-data-weekly-report-2025-10-17.md)
      * [ZIM Team Executive Roundup - Week of October 13, 2025](weekly-reports/team-reports/2025-10-17/zim-weekly-report-2025-10-17.md)
    * [2025-10-24](weekly-reports/team-reports/2025-10-24/README.md)
      * [Automation Executive Roundup - 10/24/2025](weekly-reports/team-reports/2025-10-24/automation-weekly-report-2025-10-24.md)
      * [DAI Weekly Report - October 24, 2025](weekly-reports/team-reports/2025-10-24/dai-weekly-report-2025-10-24.md)
      * [Data Platform Executive Roundup - Week of October 20, 2025](weekly-reports/team-reports/2025-10-24/data-platform-weekly-report-2025-10-24.md)
      * [Data Weekly Report - October 24, 2025](weekly-reports/team-reports/2025-10-24/data-weekly-report-2025-10-24.md)
      * [GTM Studio Executive Roundup - October 20-24, 2025](weekly-reports/team-reports/2025-10-24/gtm-studio-weekly-report-2025-10-24.md)
      * [GTM Workspace (Copilot) Weekly Report - October 24, 2025](weekly-reports/team-reports/2025-10-24/gtm-workspace-weekly-report-2025-10-24.md)
      * [Integrations Executive Roundup - October 20, 2025](weekly-reports/team-reports/2025-10-24/integrations-weekly-report-2025-10-24.md)
      * [Intelligence Weekly Report - October 24, 2025](weekly-reports/team-reports/2025-10-24/intelligence-weekly-report-2025-10-24.md)
      * [Product BI Weekly Report - October 24, 2025](weekly-reports/team-reports/2025-10-24/product-bi-weekly-report-2025-10-24.md)
      * [Product Ops Executive Roundup - October 20, 2025](weekly-reports/team-reports/2025-10-24/product-ops-weekly-report-2025-10-24.md)
      * [ZIM Team Executive Roundup - Week of October 20, 2025](weekly-reports/team-reports/2025-10-24/zim-weekly-report-2025-10-24.md)
    * [2025-10-31](weekly-reports/team-reports/2025-10-31/README.md)
      * [Admin Weekly Report - October 31, 2025](weekly-reports/team-reports/2025-10-31/admin-weekly-report-2025-10-31.md)
      * [Automation Executive Roundup - 10/31/2025](weekly-reports/team-reports/2025-10-31/automation-weekly-report-2025-10-31.md)
      * [DAI Weekly Report - October 31, 2025](weekly-reports/team-reports/2025-10-31/dai-weekly-report-2025-10-31.md)
      * [Data Platform Executive Roundup - Week of October 27, 2025](weekly-reports/team-reports/2025-10-31/data-platform-weekly-report-2025-10-31.md)
      * [Data Weekly Report - October 31, 2025](weekly-reports/team-reports/2025-10-31/data-weekly-report-2025-10-31.md)
      * [GTM Studio Weekly Report - October 31, 2025](weekly-reports/team-reports/2025-10-31/gtm-studio-weekly-report-2025-10-31.md)
      * [GTM Workspace (Copilot) Weekly Report - October 31, 2025](weekly-reports/team-reports/2025-10-31/gtm-workspace-weekly-report-2025-10-31.md)
      * [Integrations Team Executive Roundup - October 27, 2025](weekly-reports/team-reports/2025-10-31/integrations-weekly-report-2025-10-31.md)
      * [Intelligence Weekly Report - October 31, 2025](weekly-reports/team-reports/2025-10-31/intelligence-weekly-report-2025-10-31.md)
      * [MCP Tiger Team Executive Roundup - October 27-31, 2025](weekly-reports/team-reports/2025-10-31/mcp-weekly-report-2025-10-31.md)
      * [Product BI Weekly Report - October 31, 2025](weekly-reports/team-reports/2025-10-31/product-bi-weekly-report-2025-10-31.md)
      * [Product Operations Team Executive Roundup - October 27, 2025](weekly-reports/team-reports/2025-10-31/product-ops-weekly-report-2025-10-31.md)
      * [Semantic Data Team Executive Roundup - October 31, 2025](weekly-reports/team-reports/2025-10-31/semantic-data-weekly-report-2025-10-31.md)
      * [ZIM Team Executive Roundup - Week of October 27, 2025](weekly-reports/team-reports/2025-10-31/zim-weekly-report-2025-10-31.md)
    * [2025-11-07](weekly-reports/team-reports/2025-11-07/README.md)
      * [Admin Weekly Report - November 07, 2025](weekly-reports/team-reports/2025-11-07/admin-weekly-report-2025-11-07.md)
      * [Automation Executive Roundup - 11/7/2025](weekly-reports/team-reports/2025-11-07/automation-weekly-report-2025-11-07.md)
      * [DAI Weekly Report - November 07, 2025](weekly-reports/team-reports/2025-11-07/dai-weekly-report-2025-11-07.md)
      * [Data Platform Executive Roundup - November 7, 2025](weekly-reports/team-reports/2025-11-07/data-platform-weekly-report-2025-11-07.md)
      * [Data Weekly Report - November 07, 2025](weekly-reports/team-reports/2025-11-07/data-weekly-report-2025-11-07.md)
      * [GTM Studio Weekly Report - November 07, 2025](weekly-reports/team-reports/2025-11-07/gtm-studio-weekly-report-2025-11-07.md)
      * [GTM Workspace (Copilot) Weekly Report - November 07, 2025](weekly-reports/team-reports/2025-11-07/gtm-workspace-weekly-report-2025-11-07.md)
      * [Integrations Team Executive Roundup - Week of Nov 3, 2025](weekly-reports/team-reports/2025-11-07/integrations-weekly-report-2025-11-07.md)
      * [Intelligence Weekly Report - November 07, 2025](weekly-reports/team-reports/2025-11-07/intelligence-weekly-report-2025-11-07.md)
      * [MCP Tiger Team Executive Roundup - November 7th, 2025](weekly-reports/team-reports/2025-11-07/mcp-weekly-report-2025-11-07.md)
      * [PMM Engine Executive Roundup - 11/3](weekly-reports/team-reports/2025-11-07/product-marketing-weekly-report-2025-11-07.md)
      * [Product Ops Executive Roundup - November 3, 2025](weekly-reports/team-reports/2025-11-07/product-ops-weekly-report-2025-11-07.md)
      * [Semantic Data Team Executive Roundup - November 7, 2025](weekly-reports/team-reports/2025-11-07/semantic-data-weekly-report-2025-11-07.md)
      * [ZIM Team Executive Roundup - Week of November 3, 2025](weekly-reports/team-reports/2025-11-07/zim-weekly-report-2025-11-07.md)
    * [2025-11-14](weekly-reports/team-reports/2025-11-14/README.md)
      * [Automation Executive Roundup - 11/14/2025](weekly-reports/team-reports/2025-11-14/automation-weekly-report-2025-11-14.md)
      * [DAI Weekly Report - November 14, 2025](weekly-reports/team-reports/2025-11-14/dai-weekly-report-2025-11-14.md)
      * [Data Platform Team Executive Roundup - Week of November 10, 2025](weekly-reports/team-reports/2025-11-14/data-platform-weekly-report-2025-11-14.md)
      * [Data Weekly Report - November 14, 2025](weekly-reports/team-reports/2025-11-14/data-weekly-report-2025-11-14.md)
      * [GTM Studio Weekly Report - November 14, 2025](weekly-reports/team-reports/2025-11-14/gtm-studio-weekly-report-2025-11-14.md)
      * [GTM Workspace (Copilot) Weekly Report - November 14, 2025](weekly-reports/team-reports/2025-11-14/gtm-workspace-weekly-report-2025-11-14.md)
      * [Integrations Team Executive Roundup](weekly-reports/team-reports/2025-11-14/integrations-weekly-report-2025-11-14.md)
      * [Intelligence Weekly Report - November 14, 2025](weekly-reports/team-reports/2025-11-14/intelligence-weekly-report-2025-11-14.md)
      * [MCP Tiger Team Executive Roundup - November 14th, 2025](weekly-reports/team-reports/2025-11-14/mcp-weekly-report-2025-11-14.md)
      * [Product BI Weekly Report - November 14, 2025](weekly-reports/team-reports/2025-11-14/product-bi-weekly-report-2025-11-14.md)
      * [PMM Engine Team Executive Roundup - Week of November 10, 2025](weekly-reports/team-reports/2025-11-14/product-marketing-weekly-report-2025-11-14.md)
      * [Product Ops Executive Roundup - November 10, 2025](weekly-reports/team-reports/2025-11-14/product-ops-weekly-report-2025-11-14.md)
      * [Semantic Data Team Executive Roundup - November 14, 2025](weekly-reports/team-reports/2025-11-14/semantic-data-weekly-report-2025-11-14.md)
      * [ZIM Team Executive Roundup - Week of November 10, 2025](weekly-reports/team-reports/2025-11-14/zim-weekly-report-2025-11-14.md)
    * [2025-11-21](weekly-reports/team-reports/2025-11-21/README.md)
      * [Automation Executive Roundup - 11/21/2025](weekly-reports/team-reports/2025-11-21/automation-weekly-report-2025-11-21.md)
      * [Data Platform Executive Roundup - November 21, 2025](weekly-reports/team-reports/2025-11-21/data-platform-weekly-report-2025-11-21.md)
      * [Core Data Executive Roundup - Week of November 17-21, 2025](weekly-reports/team-reports/2025-11-21/data-weekly-report-2025-11-21.md)
      * [Integrations Team Executive Roundup - Week of Nov 17, 2025](weekly-reports/team-reports/2025-11-21/integrations-weekly-report-2025-11-21.md)
      * [MCP Tiger Team Executive Roundup - November 17th-21st, 2025](weekly-reports/team-reports/2025-11-21/mcp-weekly-report-2025-11-21.md)
      * [Product BI Weekly Report - November 21, 2025](weekly-reports/team-reports/2025-11-21/product-bi-weekly-report-2025-11-21.md)
      * [PMM Engine Team Executive Roundup - November 17-21, 2025](weekly-reports/team-reports/2025-11-21/product-marketing-weekly-report-2025-11-21.md)
      * [Product Ops Executive Roundup - November 17-21, 2025](weekly-reports/team-reports/2025-11-21/product-ops-weekly-report-2025-11-21.md)
      * [Semantic Data Team Executive Roundup - November 21, 2025](weekly-reports/team-reports/2025-11-21/semantic-data-weekly-report-2025-11-21.md)
      * [ZIM Team Executive Roundup - Week of November 17, 2025](weekly-reports/team-reports/2025-11-21/zim-weekly-report-2025-11-21.md)
    * [2025-12-19](weekly-reports/team-reports/2025-12-19/README.md)
      * [GTM Workspace Executive Roundup - \[Dec. 15, 2025 - Dec. 19, 2025\]](weekly-reports/team-reports/2025-12-19/gtm-workspace-weekly-report-2025-12-19.md)
* [.claude](.claude/README.md)
  * [skills](.claude/skills/README.md)
    * [{Skill Name}](.claude/skills/_skill-template.md)
    * [Create Document](.claude/skills/create-doc.md)
    * [Create Skill](.claude/skills/create-skill.md)
    * [Convert Document](.claude/skills/import-doc.md)
    * [Onboard to PM Repository](.claude/skills/onboard.md)
    * [Resolve Conflicts Skill](.claude/skills/resolve-conflicts.md)
    * [PM Repository Search & Navigation](.claude/skills/search-repo.md)
    * [Search & Synthesis](.claude/skills/synthesize.md)
    * [Agent PRD Skill](.claude/skills/agent-prd/README.md)
      * [Agent PRD Skill](.claude/skills/agent-prd/SKILL.md)
      * [references](.claude/skills/agent-prd/references/README.md)
        * [Agent PRD Quality Criteria](.claude/skills/agent-prd/references/quality-criteria.md)
    * [team-weekly-report](.claude/skills/team-weekly-report/README.md)
      * [Team Weekly Report Writing Constraints](.claude/skills/team-weekly-report/CONSTRAINTS.md)
      * [Gap Analysis: Team Weekly Report Skill vs Original System Prompt](.claude/skills/team-weekly-report/GAP-ANALYSIS.md)
      * [Team Weekly Report Generator](.claude/skills/team-weekly-report/SKILL.md)
      * [Team Weekly Report Template](.claude/skills/team-weekly-report/TEMPLATE.md)
    * [weekly-synthesis](.claude/skills/weekly-synthesis/README.md)
      * [Weekly Synthesis Analysis Constraints](.claude/skills/weekly-synthesis/CONSTRAINTS.md)
      * [Prompts](.claude/skills/weekly-synthesis/PROMPT-REFERENCE.md)
      * [Reference Documents for Weekly Synthesis](.claude/skills/weekly-synthesis/REFERENCE.md)
      * [Weekly Synthesis](.claude/skills/weekly-synthesis/SKILL.md)
      * [Weekly Synthesis Report Template](.claude/skills/weekly-synthesis/TEMPLATE.md)
* [teams](teams/README.md)
  * [gtm-studio](teams/gtm-studio/README.md)
    * [weekly-reports](teams/gtm-studio/weekly-reports/README.md)
      * [GTM Studio Roundup - 07/28/2025](teams/gtm-studio/weekly-reports/gtm-studio-weekly-report-2025-08-01.md)
      * [GTM Studio Roundup - 08/04/2025](teams/gtm-studio/weekly-reports/gtm-studio-weekly-report-2025-08-08.md)
      * [GTM Studio Executive Roundup - 08/15/2025](teams/gtm-studio/weekly-reports/gtm-studio-weekly-report-2025-08-15.md)
      * [GTM Studio Executive Roundup - 08/22/2025](teams/gtm-studio/weekly-reports/gtm-studio-weekly-report-2025-08-22.md)
      * [GTM Studio Executive Roundup - 08/29/2025](teams/gtm-studio/weekly-reports/gtm-studio-weekly-report-2025-08-29.md)
      * [GTM Studio Executive Roundup - September 1-5, 2025](teams/gtm-studio/weekly-reports/gtm-studio-weekly-report-2025-09-06.md)
      * [GTM Studio Executive Roundup - September 8-12, 2025](teams/gtm-studio/weekly-reports/gtm-studio-weekly-report-2025-09-12.md)
      * [GTM Studio Executive Roundup - September 15-19](teams/gtm-studio/weekly-reports/gtm-studio-weekly-report-2025-09-19.md)
      * [GTM Studio Executive Roundup - September 26, 2025](teams/gtm-studio/weekly-reports/gtm-studio-weekly-report-2025-09-26.md)
      * [GTM Studio Weekly Report - October 03, 2025](teams/gtm-studio/weekly-reports/gtm-studio-weekly-report-2025-10-03.md)
      * [GTM Studio Weekly Report - October 10, 2025](teams/gtm-studio/weekly-reports/gtm-studio-weekly-report-2025-10-10.md)
      * [GTM Studio Weekly Report - October 17, 2025](teams/gtm-studio/weekly-reports/gtm-studio-weekly-report-2025-10-17.md)
      * [GTM Studio Executive Roundup - October 20-24, 2025](teams/gtm-studio/weekly-reports/gtm-studio-weekly-report-2025-10-24.md)
      * [GTM Studio Weekly Report - October 31, 2025](teams/gtm-studio/weekly-reports/gtm-studio-weekly-report-2025-10-31.md)
      * [GTM Studio Weekly Report - November 07, 2025](teams/gtm-studio/weekly-reports/gtm-studio-weekly-report-2025-11-07.md)
      * [GTM Studio Weekly Report - November 14, 2025](teams/gtm-studio/weekly-reports/gtm-studio-weekly-report-2025-11-14.md)
      * [GTM Studio Executive Roundup - December 27, 2025](teams/gtm-studio/weekly-reports/gtm-studio-weekly-report-2025-12-27.md)
  * [gtm-workspace](teams/gtm-workspace/README.md)
    * [weekly-reports](teams/gtm-workspace/weekly-reports/README.md)
      * [Apps Executive Roundup - Monday June 30 - Thursday July 3](teams/gtm-workspace/weekly-reports/copilot-weekly-report-2025-07-04.md)
      * [GTM Workspace (Copilot) Weekly Report - August 01, 2025](teams/gtm-workspace/weekly-reports/gtm-workspace-weekly-report-2025-08-01.md)
      * [GTM Workspace (Copilot) Weekly Report - August 08, 2025](teams/gtm-workspace/weekly-reports/gtm-workspace-weekly-report-2025-08-08.md)
      * [GTM Workspace (Copilot) Weekly Report - August 15, 2025](teams/gtm-workspace/weekly-reports/gtm-workspace-weekly-report-2025-08-15.md)
      * [GTM Workspace (Copilot) Weekly Report - August 22, 2025](teams/gtm-workspace/weekly-reports/gtm-workspace-weekly-report-2025-08-22.md)
      * [GTM Workspace (Copilot) Weekly Report - August 29, 2025](teams/gtm-workspace/weekly-reports/gtm-workspace-weekly-report-2025-08-29.md)
      * [GTM Workspace (Copilot) Weekly Report - September 06, 2025](teams/gtm-workspace/weekly-reports/gtm-workspace-weekly-report-2025-09-06.md)
      * [GTM Workspace (Copilot) Weekly Report - September 19, 2025](teams/gtm-workspace/weekly-reports/gtm-workspace-weekly-report-2025-09-19.md)
      * [GTM Workspace (Copilot) Weekly Report - September 26, 2025](teams/gtm-workspace/weekly-reports/gtm-workspace-weekly-report-2025-09-26.md)
      * [GTM Workspace (Copilot) Weekly Report - October 03, 2025](teams/gtm-workspace/weekly-reports/gtm-workspace-weekly-report-2025-10-03.md)
      * [GTM Workspace (Copilot) Weekly Report - October 10, 2025](teams/gtm-workspace/weekly-reports/gtm-workspace-weekly-report-2025-10-10.md)
      * [GTM Workspace (Copilot) Weekly Report - October 17, 2025](teams/gtm-workspace/weekly-reports/gtm-workspace-weekly-report-2025-10-17.md)
      * [GTM Workspace (Copilot) Weekly Report - October 24, 2025](teams/gtm-workspace/weekly-reports/gtm-workspace-weekly-report-2025-10-24.md)
      * [GTM Workspace (Copilot) Weekly Report - October 31, 2025](teams/gtm-workspace/weekly-reports/gtm-workspace-weekly-report-2025-10-31.md)
      * [GTM Workspace (Copilot) Weekly Report - November 07, 2025](teams/gtm-workspace/weekly-reports/gtm-workspace-weekly-report-2025-11-07.md)
      * [GTM Workspace (Copilot) Weekly Report - November 14, 2025](teams/gtm-workspace/weekly-reports/gtm-workspace-weekly-report-2025-11-14.md)
      * [GTM Workspace Executive Roundup - \[Dec. 15, 2025 - Dec. 19, 2025\]](teams/gtm-workspace/weekly-reports/gtm-workspace-weekly-report-2025-12-19.md)
  * [leadership](teams/leadership/README.md)
    * [documentation](teams/leadership/documentation/README.md)
      * [2026 ZoomInfo Roadmap](<teams/leadership/documentation/2026 ZoomInfo Roadmap.md>)
      * [2026-01-05 The Evolution of ZoomInfo's Data Asset](<teams/leadership/documentation/2026-01-05 The Evolution of ZoomInfo's Data Asset.md>)
      * [2026-01-06 Context in GTM Roadmap Memo](<teams/leadership/documentation/2026-01-06 Context in GTM Roadmap Memo.md>)
      * [weekly-product-executive-reports](teams/leadership/documentation/weekly-product-executive-reports/README.md)
        * [Product Org Synthesized Operating Report - Week of 6/23](teams/leadership/documentation/weekly-product-executive-reports/product-executive-report-2025-06-27.md)
        * [Product Executive Intelligence Brief - July 04, 2025](teams/leadership/documentation/weekly-product-executive-reports/product-executive-report-2025-07-04.md)
        * [Product Executive Intelligence Brief - July 11, 2025](teams/leadership/documentation/weekly-product-executive-reports/product-executive-report-2025-07-11.md)
        * [Product Executive Intelligence Brief - July 18, 2025](teams/leadership/documentation/weekly-product-executive-reports/product-executive-report-2025-07-18.md)
        * [Product Executive Intelligence Brief - July 25, 2025](teams/leadership/documentation/weekly-product-executive-reports/product-executive-report-2025-07-25.md)
        * [Product Executive Intelligence Brief - August 01, 2025](teams/leadership/documentation/weekly-product-executive-reports/product-executive-report-2025-08-01.md)
        * [Product Executive Intelligence Brief - August 08, 2025](teams/leadership/documentation/weekly-product-executive-reports/product-executive-report-2025-08-08.md)
        * [Product Executive Intelligence Brief - August 15, 2025](teams/leadership/documentation/weekly-product-executive-reports/product-executive-report-2025-08-15.md)
        * [Product Executive Intelligence Brief - August 22, 2025](teams/leadership/documentation/weekly-product-executive-reports/product-executive-report-2025-08-22.md)
        * [Product Executive Intelligence Brief - August 29, 2025](teams/leadership/documentation/weekly-product-executive-reports/product-executive-report-2025-08-29.md)
        * [Product Executive Intelligence Brief - September 05, 2025](teams/leadership/documentation/weekly-product-executive-reports/product-executive-report-2025-09-05.md)
        * [Product Executive Intelligence Brief - September 12, 2025](teams/leadership/documentation/weekly-product-executive-reports/product-executive-report-2025-09-12.md)
        * [Product Executive Intelligence Brief - September 19, 2025](teams/leadership/documentation/weekly-product-executive-reports/product-executive-report-2025-09-19.md)
        * [Product Executive Intelligence Brief - September 26, 2025](teams/leadership/documentation/weekly-product-executive-reports/product-executive-report-2025-09-26.md)
        * [Product Executive Intelligence Brief - September 29 - October 3, 2025](teams/leadership/documentation/weekly-product-executive-reports/product-executive-report-2025-10-03.md)
        * [Product Executive Intelligence Brief - October 6-10, 2025](teams/leadership/documentation/weekly-product-executive-reports/product-executive-report-2025-10-10.md)
        * [Product Executive Intelligence Brief - October 17, 2025](teams/leadership/documentation/weekly-product-executive-reports/product-executive-report-2025-10-17.md)
        * [Product Executive Intelligence Brief - October 24, 2025](teams/leadership/documentation/weekly-product-executive-reports/product-executive-report-2025-10-24.md)
        * [Product Executive Intelligence Brief - October 31, 2025](teams/leadership/documentation/weekly-product-executive-reports/product-executive-report-2025-10-31.md)
        * [Product Executive Intelligence Brief - November 07, 2025](teams/leadership/documentation/weekly-product-executive-reports/product-executive-report-2025-11-07.md)
        * [Product Executive Intelligence Brief - November 14, 2025](teams/leadership/documentation/weekly-product-executive-reports/product-executive-report-2025-11-14.md)
        * [Product Executive Intelligence Brief - November 21, 2025](teams/leadership/documentation/weekly-product-executive-reports/product-executive-report-2025-11-21.md)
        * [Product Executive Intelligence Brief - December 05, 2025](teams/leadership/documentation/weekly-product-executive-reports/product-executive-report-2025-12-05.md)
        * [Product Executive Intelligence Brief - December 12, 2025](teams/leadership/documentation/weekly-product-executive-reports/product-executive-report-2025-12-12.md)
    * [weekly-reports](teams/leadership/weekly-reports/README.md)
      * [Product DAI Executive Report - Week of June 30th](teams/leadership/weekly-reports/dai-weekly-report-2025-07-04.md)
      * [DAI Weekly Report - July 11, 2025](teams/leadership/weekly-reports/dai-weekly-report-2025-07-11.md)
      * [DAI Weekly Report - July 18, 2025](teams/leadership/weekly-reports/dai-weekly-report-2025-07-18.md)
      * [DAI Weekly Report - July 25, 2025](teams/leadership/weekly-reports/dai-weekly-report-2025-07-25.md)
      * [DAI Weekly Report - August 01, 2025](teams/leadership/weekly-reports/dai-weekly-report-2025-08-01.md)
      * [DAI Weekly Report - August 08, 2025](teams/leadership/weekly-reports/dai-weekly-report-2025-08-08.md)
      * [DAI Weekly Report - August 15, 2025](teams/leadership/weekly-reports/dai-weekly-report-2025-08-15.md)
      * [DAI Weekly Report - August 22, 2025](teams/leadership/weekly-reports/dai-weekly-report-2025-08-22.md)
      * [DAI Weekly Report - August 29, 2025](teams/leadership/weekly-reports/dai-weekly-report-2025-08-29.md)
      * [DAI Weekly Report - September 06, 2025](teams/leadership/weekly-reports/dai-weekly-report-2025-09-06.md)
      * [DAI Weekly Report - September 12, 2025](teams/leadership/weekly-reports/dai-weekly-report-2025-09-12.md)
      * [DAI Weekly Report - September 19, 2025](teams/leadership/weekly-reports/dai-weekly-report-2025-09-19.md)
      * [DAI Weekly Report - September 26, 2025](teams/leadership/weekly-reports/dai-weekly-report-2025-09-26.md)
      * [DAI Weekly Report - October 03, 2025](teams/leadership/weekly-reports/dai-weekly-report-2025-10-03.md)
      * [DAI Weekly Report - October 10, 2025](teams/leadership/weekly-reports/dai-weekly-report-2025-10-10.md)
      * [DAI Weekly Report - October 17, 2025](teams/leadership/weekly-reports/dai-weekly-report-2025-10-17.md)
      * [DAI Weekly Report - October 24, 2025](teams/leadership/weekly-reports/dai-weekly-report-2025-10-24.md)
      * [DAI Weekly Report - October 31, 2025](teams/leadership/weekly-reports/dai-weekly-report-2025-10-31.md)
      * [DAI Weekly Report - November 07, 2025](teams/leadership/weekly-reports/dai-weekly-report-2025-11-07.md)
      * [DAI Weekly Report - November 14, 2025](teams/leadership/weekly-reports/dai-weekly-report-2025-11-14.md)
  * [ops](teams/ops/README.md)
    * [\[subteam\]-product-ops](teams/ops/subteam-product-ops/README.md)
      * [Product Knowledge Repository - Design Principles](teams/ops/\[subteam]-product-ops/product-knowledge-repository-design-principles.md)
      * [Early-Access](teams/ops/subteam-product-ops/early-access/README.md)
        * [PM Guide\_ Rapid Release Workflow (Workspace & Studio)](<teams/ops/\[subteam]-product-ops/Early-Access/PM Guide_ Rapid Release Workflow (Workspace & Studio).md>)
      * [VOC](teams/ops/subteam-product-ops/voc/README.md)
        * [20251013-20251126 VOC ANALYSIS Vertical Datasets](<teams/ops/\[subteam]-product-ops/VOC/20251013-20251126 VOC ANALYSIS Vertical Datasets.md>)
        * [VOC Competitive Intelligence Report](<teams/ops/\[subteam]-product-ops/VOC/20251015-20260106 VOC ANALYSIS COMPETITIVE INTELLIGENCE.md>)
        * [20251103-20251117 VOC ANALYSIS GTM STUDIO](<teams/ops/\[subteam]-product-ops/VOC/20251103-20251117 VOC ANALYSIS GTM STUDIO.md>)
        * [20251103-20251117 VOC ANALYSIS GTM WORKSPACE](<teams/ops/\[subteam]-product-ops/VOC/20251103-20251117 VOC ANALYSIS GTM WORKSPACE.md>)
        * [20251117-20251201 VOC ANALYSIS GTM STUDIO](<teams/ops/\[subteam]-product-ops/VOC/20251117-20251201 VOC ANALYSIS GTM STUDIO.md>)
        * [20251118-20251201 VOC ANALYSIS GTM WORKSPACE](<teams/ops/\[subteam]-product-ops/VOC/20251118-20251201 VOC ANALYSIS GTM WORKSPACE.md>)
        * [VOICE OF CUSTOMER ANALYSIS: GTM STUDIO](<teams/ops/\[subteam]-product-ops/VOC/20251128-20251212 VOC ANALYSIS GTM STUDIO.md>)
        * [VOICE OF CUSTOMER ANALYSIS: GTM WORKSPACE](<teams/ops/\[subteam]-product-ops/VOC/20251128-20251212 VOC ANALYSIS GTM WORKSPACE.md>)
        * [VOICE OF CUSTOMER ANALYSIS: GTM STUDIO](<teams/ops/\[subteam]-product-ops/VOC/20251212-20251231 VOC ANALYSIS GTM STUDIO.md>)
        * [VOICE OF CUSTOMER ANALYSIS: GTM STUDIO](<teams/ops/\[subteam]-product-ops/VOC/20251212-20251231 VOC ANALYSIS GTM WORKSPACE.md>)
      * [weekly-reports](teams/ops/subteam-product-ops/weekly-reports/README.md)
        * [Product Ops Team Executive Roundup - Week of June 30th](teams/ops/\[subteam]-product-ops/weekly-reports/product-ops-weekly-report-2025-07-04.md)
        * [Product Ops Executive Roundup - July 7-11](teams/ops/\[subteam]-product-ops/weekly-reports/product-ops-weekly-report-2025-07-11.md)
        * [Product Ops Team Executive Roundup - July 14, 2025](teams/ops/\[subteam]-product-ops/weekly-reports/product-ops-weekly-report-2025-07-18.md)
        * [Product Ops Executive Roundup - July 21, 2025](teams/ops/\[subteam]-product-ops/weekly-reports/product-ops-weekly-report-2025-07-25.md)
        * [\[Product Operations\] Executive Roundup - \[7/28-8/1\]](teams/ops/\[subteam]-product-ops/weekly-reports/product-ops-weekly-report-2025-08-01.md)
        * [Product Ops Executive Roundup - August 4-8, 2025](teams/ops/\[subteam]-product-ops/weekly-reports/product-ops-weekly-report-2025-08-08.md)
        * [Product Ops Executive Roundup - August 15, 2025](teams/ops/\[subteam]-product-ops/weekly-reports/product-ops-weekly-report-2025-08-15.md)
        * [Product Ops Executive Roundup - 8/22/25](teams/ops/\[subteam]-product-ops/weekly-reports/product-ops-weekly-report-2025-08-22.md)
        * [Product Ops Executive Roundup - August 25, 2025](teams/ops/\[subteam]-product-ops/weekly-reports/product-ops-weekly-report-2025-08-29.md)
        * [Product Ops Executive Roundup - September 2, 2025](teams/ops/\[subteam]-product-ops/weekly-reports/product-ops-weekly-report-2025-09-06.md)
        * [Product Ops Executive Roundup - September 8-12, 2025](teams/ops/\[subteam]-product-ops/weekly-reports/product-ops-weekly-report-2025-09-12.md)
        * [Product Operations Team Executive Roundup - September 15, 2025](teams/ops/\[subteam]-product-ops/weekly-reports/product-ops-weekly-report-2025-09-19.md)
        * [Product Ops Team Executive Roundup - September 22-26, 2025](teams/ops/\[subteam]-product-ops/weekly-reports/product-ops-weekly-report-2025-09-26.md)
        * [Product Ops Executive Roundup - September 29, 2025](teams/ops/\[subteam]-product-ops/weekly-reports/product-ops-weekly-report-2025-10-03.md)
        * [Product Ops Team Executive Roundup - October 6-10, 2025](teams/ops/\[subteam]-product-ops/weekly-reports/product-ops-weekly-report-2025-10-10.md)
        * [Product Ops Executive Roundup - October 13, 2025](teams/ops/\[subteam]-product-ops/weekly-reports/product-ops-weekly-report-2025-10-17.md)
        * [Product Ops Executive Roundup - October 20, 2025](teams/ops/\[subteam]-product-ops/weekly-reports/product-ops-weekly-report-2025-10-24.md)
        * [Product Operations Team Executive Roundup - October 27, 2025](teams/ops/\[subteam]-product-ops/weekly-reports/product-ops-weekly-report-2025-10-31.md)
        * [Product Ops Executive Roundup - November 3, 2025](teams/ops/\[subteam]-product-ops/weekly-reports/product-ops-weekly-report-2025-11-07.md)
        * [Product Ops Executive Roundup - November 10, 2025](teams/ops/\[subteam]-product-ops/weekly-reports/product-ops-weekly-report-2025-11-14.md)
        * [Product Ops Executive Roundup - November 17-21, 2025](teams/ops/\[subteam]-product-ops/weekly-reports/product-ops-weekly-report-2025-11-21.md)
    * [\_people](teams/ops/_people/README.md)
      * [Brett Jacobs](teams/ops/_people/brett-jacobs.md)
      * [Daniel Kong](teams/ops/_people/daniel-kong.md)
      * [Ken Elwell](teams/ops/_people/ken-elwell.md)
      * [Kristin Gandini](teams/ops/_people/kristin-gandini.md)
      * [Sam D'Arcy](teams/ops/_people/sam-darcy.md)
    * [documentation](teams/ops/documentation/README.md)
      * [Product Knowledge Repository - Design Principles](teams/ops/documentation/product-knowledge-repository-design-principles.md)
      * [Roadmap: Early Access Marketable Releases](teams/ops/documentation/releases.md)
      * [Test CODEOWNERS Self-Approval](teams/ops/documentation/test-codeowners.md)
    * [\[subteam\]-business-intelligence](teams/ops/subteam-business-intelligence/README.md)
      * [weekly-reports](teams/ops/subteam-business-intelligence/weekly-reports/README.md)
        * [Analytics Team Executive Roundup - July 11, 2025](teams/ops/\[subteam]-business-intelligence/weekly-reports/product-bi-weekly-report-2025-07-11.md)
        * [Product BI Weekly Report - September 06, 2025](teams/ops/\[subteam]-business-intelligence/weekly-reports/product-bi-weekly-report-2025-09-06.md)
        * [Product BI Weekly Report - September 12, 2025](teams/ops/\[subteam]-business-intelligence/weekly-reports/product-bi-weekly-report-2025-09-12.md)
        * [Product BI Weekly Report - September 19, 2025](teams/ops/\[subteam]-business-intelligence/weekly-reports/product-bi-weekly-report-2025-09-19.md)
        * [Product BI Weekly Report - September 26, 2025](teams/ops/\[subteam]-business-intelligence/weekly-reports/product-bi-weekly-report-2025-09-26.md)
        * [Product BI Weekly Report - October 03, 2025](teams/ops/\[subteam]-business-intelligence/weekly-reports/product-bi-weekly-report-2025-10-03.md)
        * [Product BI Weekly Report - October 17, 2025](teams/ops/\[subteam]-business-intelligence/weekly-reports/product-bi-weekly-report-2025-10-17.md)
        * [Product BI Weekly Report - October 24, 2025](teams/ops/\[subteam]-business-intelligence/weekly-reports/product-bi-weekly-report-2025-10-24.md)
        * [Product BI Weekly Report - October 31, 2025](teams/ops/\[subteam]-business-intelligence/weekly-reports/product-bi-weekly-report-2025-10-31.md)
        * [Product BI Weekly Report - November 14, 2025](teams/ops/\[subteam]-business-intelligence/weekly-reports/product-bi-weekly-report-2025-11-14.md)
        * [Product BI Weekly Report - November 21, 2025](teams/ops/\[subteam]-business-intelligence/weekly-reports/product-bi-weekly-report-2025-11-21.md)
    * [\[subteam\]-product-marketing](teams/ops/subteam-product-marketing/README.md)
      * [weekly-reports](teams/ops/subteam-product-marketing/weekly-reports/README.md)
        * [Product Marketing Team Executive Roundup - August 8, 2025](teams/ops/\[subteam]-product-marketing/weekly-reports/product-marketing-weekly-report-2025-08-08.md)
        * [Product Marketing Executive Roundup - September 29, 2025](teams/ops/\[subteam]-product-marketing/weekly-reports/product-marketing-weekly-report-2025-10-03.md)
        * [Product Marketing Executive Roundup - October 17, 2025](teams/ops/\[subteam]-product-marketing/weekly-reports/product-marketing-weekly-report-2025-10-17.md)
        * [PMM Engine Executive Roundup - 11/3](teams/ops/\[subteam]-product-marketing/weekly-reports/product-marketing-weekly-report-2025-11-07.md)
        * [PMM Engine Team Executive Roundup - Week of November 10, 2025](teams/ops/\[subteam]-product-marketing/weekly-reports/product-marketing-weekly-report-2025-11-14.md)
        * [PMM Engine Team Executive Roundup - November 17-21, 2025](teams/ops/\[subteam]-product-marketing/weekly-reports/product-marketing-weekly-report-2025-11-21.md)
  * [data](teams/data/README.md)
    * [\[subteam\]-core-data](teams/data/subteam-core-data/README.md)
      * [weekly-reports](teams/data/subteam-core-data/weekly-reports/README.md)
        * [Core Data Executive Roundup - Week of 06/23](teams/data/\[subteam]-core-data/weekly-reports/core-data-weekly-report-2025-06-27.md)
        * [Core Data Executive Roundup - Week of 06/30 - 07/03](teams/data/\[subteam]-core-data/weekly-reports/core-data-weekly-report-2025-07-04.md)
        * [Core Data Executive Roundup - Week of 07/07 - 07/11](teams/data/\[subteam]-core-data/weekly-reports/core-data-weekly-report-2025-07-11.md)
        * [Core Data Executive Roundup - Week of 07/14 - 07/18](teams/data/\[subteam]-core-data/weekly-reports/core-data-weekly-report-2025-07-18.md)
        * [Core Data Executive Roundup - Week of 07/21 - 07/25](teams/data/\[subteam]-core-data/weekly-reports/core-data-weekly-report-2025-07-25.md)
    * [\[subteam\]-data-executive-team](teams/data/subteam-data-executive-team/README.md)
      * [weekly-reports](teams/data/subteam-data-executive-team/weekly-reports/README.md)
        * [Data Team Executive Roundup - Monday June 30 - Thursday July 3](teams/data/\[subteam]-data-executive-team/weekly-reports/data-weekly-report-2025-07-04.md)
        * [Data Weekly Report - July 11, 2025](teams/data/\[subteam]-data-executive-team/weekly-reports/data-weekly-report-2025-07-11.md)
        * [Data Weekly Report - July 18, 2025](teams/data/\[subteam]-data-executive-team/weekly-reports/data-weekly-report-2025-07-18.md)
        * [Data Weekly Report - July 25, 2025](teams/data/\[subteam]-data-executive-team/weekly-reports/data-weekly-report-2025-07-25.md)
        * [Data Weekly Report - August 01, 2025](teams/data/\[subteam]-data-executive-team/weekly-reports/data-weekly-report-2025-08-01.md)
        * [Data Weekly Report - August 08, 2025](teams/data/\[subteam]-data-executive-team/weekly-reports/data-weekly-report-2025-08-08.md)
        * [Data Weekly Report - August 15, 2025](teams/data/\[subteam]-data-executive-team/weekly-reports/data-weekly-report-2025-08-15.md)
        * [Data Weekly Report - August 22, 2025](teams/data/\[subteam]-data-executive-team/weekly-reports/data-weekly-report-2025-08-22.md)
        * [Core Data Executive Roundup - Week of 08/25-08/29](teams/data/\[subteam]-data-executive-team/weekly-reports/data-weekly-report-2025-08-29.md)
        * [Data Weekly Report - September 06, 2025](teams/data/\[subteam]-data-executive-team/weekly-reports/data-weekly-report-2025-09-06.md)
        * [Data Weekly Report - September 12, 2025](teams/data/\[subteam]-data-executive-team/weekly-reports/data-weekly-report-2025-09-12.md)
        * [Data Weekly Report - September 19, 2025](teams/data/\[subteam]-data-executive-team/weekly-reports/data-weekly-report-2025-09-19.md)
        * [Data Weekly Report - September 26, 2025](teams/data/\[subteam]-data-executive-team/weekly-reports/data-weekly-report-2025-09-26.md)
        * [Data Weekly Report - October 03, 2025](teams/data/\[subteam]-data-executive-team/weekly-reports/data-weekly-report-2025-10-03.md)
        * [Data Weekly Report - October 10, 2025](teams/data/\[subteam]-data-executive-team/weekly-reports/data-weekly-report-2025-10-10.md)
        * [Data Weekly Report - October 17, 2025](teams/data/\[subteam]-data-executive-team/weekly-reports/data-weekly-report-2025-10-17.md)
        * [Data Weekly Report - October 24, 2025](teams/data/\[subteam]-data-executive-team/weekly-reports/data-weekly-report-2025-10-24.md)
        * [Data Weekly Report - October 31, 2025](teams/data/\[subteam]-data-executive-team/weekly-reports/data-weekly-report-2025-10-31.md)
        * [Data Weekly Report - November 07, 2025](teams/data/\[subteam]-data-executive-team/weekly-reports/data-weekly-report-2025-11-07.md)
        * [Data Weekly Report - November 14, 2025](teams/data/\[subteam]-data-executive-team/weekly-reports/data-weekly-report-2025-11-14.md)
        * [Core Data Executive Roundup - Week of November 17-21, 2025](teams/data/\[subteam]-data-executive-team/weekly-reports/data-weekly-report-2025-11-21.md)
  * [intelligence](teams/intelligence/README.md)
    * [\[subteam\]-context-engineering](teams/intelligence/subteam-context-engineering/README.md)
      * [weekly-reports](teams/intelligence/subteam-context-engineering/weekly-reports/README.md)
        * [Context Engineering Executive Roundup - July 18, 2025](teams/intelligence/\[subteam]-context-engineering/weekly-reports/context-engineering-weekly-report-2025-07-18.md)
        * [Context Engineering Team Executive Roundup - July 25, 2025](teams/intelligence/\[subteam]-context-engineering/weekly-reports/context-engineering-weekly-report-2025-07-25.md)
        * [Context Engineering Team Executive Roundup - August 1st, 2025](teams/intelligence/\[subteam]-context-engineering/weekly-reports/context-engineering-weekly-report-2025-08-01.md)
        * [Context Engineering Team Executive Roundup - August 22, 2025](teams/intelligence/\[subteam]-context-engineering/weekly-reports/context-engineering-weekly-report-2025-08-22.md)
        * [Context Engineering Team Executive Roundup - August 29, 2025](teams/intelligence/\[subteam]-context-engineering/weekly-reports/context-engineering-weekly-report-2025-08-29.md)
        * [Context Engineering Team Executive Roundup - September 5, 2025](teams/intelligence/\[subteam]-context-engineering/weekly-reports/context-engineering-weekly-report-2025-09-06.md)
        * [Context Engineering Team Executive Roundup - September 12, 2025](teams/intelligence/\[subteam]-context-engineering/weekly-reports/context-engineering-weekly-report-2025-09-12.md)
        * [Context Engineering Team Executive Roundup - September 19, 2025](teams/intelligence/\[subteam]-context-engineering/weekly-reports/context-engineering-weekly-report-2025-09-19.md)
        * [Context Engineering Team Executive Roundup](teams/intelligence/\[subteam]-context-engineering/weekly-reports/context-engineering-weekly-report-2025-09-26.md)
    * [\[subteam\]-intelligence-executive-team](teams/intelligence/subteam-intelligence-executive-team/README.md)
      * [weekly-reports](teams/intelligence/subteam-intelligence-executive-team/weekly-reports/README.md)
        * [Intelligence Team Executive Roundup - June 27, 2025](teams/intelligence/\[subteam]-intelligence-executive-team/weekly-reports/intelligence-weekly-report-2025-06-27.md)
        * [Business Intelligence Team Executive Roundup - July 3, 2025](teams/intelligence/\[subteam]-intelligence-executive-team/weekly-reports/intelligence-weekly-report-2025-07-04.md)
        * [Intelligence Team Executive Roundup - July 11, 2025](teams/intelligence/\[subteam]-intelligence-executive-team/weekly-reports/intelligence-weekly-report-2025-07-11.md)
        * [Business Intelligence Team Executive Roundup - August 8, 2025](teams/intelligence/\[subteam]-intelligence-executive-team/weekly-reports/intelligence-weekly-report-2025-08-08.md)
        * [Intelligence Team Executive Roundup - August 22, 2025](teams/intelligence/\[subteam]-intelligence-executive-team/weekly-reports/intelligence-weekly-report-2025-08-22.md)
        * [Intelligence Weekly Report - September 26, 2025](teams/intelligence/\[subteam]-intelligence-executive-team/weekly-reports/intelligence-weekly-report-2025-09-26.md)
        * [Intelligence Weekly Report - October 03, 2025](teams/intelligence/\[subteam]-intelligence-executive-team/weekly-reports/intelligence-weekly-report-2025-10-03.md)
        * [Intelligence Weekly Report - October 10, 2025](teams/intelligence/\[subteam]-intelligence-executive-team/weekly-reports/intelligence-weekly-report-2025-10-10.md)
        * [Intelligence Weekly Report - October 17, 2025](teams/intelligence/\[subteam]-intelligence-executive-team/weekly-reports/intelligence-weekly-report-2025-10-17.md)
        * [Intelligence Weekly Report - October 24, 2025](teams/intelligence/\[subteam]-intelligence-executive-team/weekly-reports/intelligence-weekly-report-2025-10-24.md)
        * [Intelligence Weekly Report - October 31, 2025](teams/intelligence/\[subteam]-intelligence-executive-team/weekly-reports/intelligence-weekly-report-2025-10-31.md)
        * [Intelligence Weekly Report - November 07, 2025](teams/intelligence/\[subteam]-intelligence-executive-team/weekly-reports/intelligence-weekly-report-2025-11-07.md)
        * [Intelligence Weekly Report - November 14, 2025](teams/intelligence/\[subteam]-intelligence-executive-team/weekly-reports/intelligence-weekly-report-2025-11-14.md)
    * [\[subteam\]-mcp](teams/intelligence/subteam-mcp/README.md)
      * [weekly-reports](teams/intelligence/subteam-mcp/weekly-reports/README.md)
        * [MCP Team Executive Roundup - September 5th, 2025](teams/intelligence/\[subteam]-mcp/weekly-reports/mcp-weekly-report-2025-09-06.md)
        * [MCP Team Executive Roundup - September 8-12, 2025](teams/intelligence/\[subteam]-mcp/weekly-reports/mcp-weekly-report-2025-09-12.md)
        * [MCP Team Roundup - September 19th, 2025](teams/intelligence/\[subteam]-mcp/weekly-reports/mcp-weekly-report-2025-09-19.md)
        * [MCP Team Executive Roundup - September 26, 2025](teams/intelligence/\[subteam]-mcp/weekly-reports/mcp-weekly-report-2025-09-26.md)
        * [Agent Platform Team Executive Roundup - October 3, 2025](teams/intelligence/\[subteam]-mcp/weekly-reports/mcp-weekly-report-2025-10-03.md)
        * [MCP Tiger Team Executive Roundup - October 10, 2025](teams/intelligence/\[subteam]-mcp/weekly-reports/mcp-weekly-report-2025-10-10.md)
        * [MCP Tiger Team Executive Roundup - October 13-17, 2025](teams/intelligence/\[subteam]-mcp/weekly-reports/mcp-weekly-report-2025-10-17.md)
        * [MCP Tiger Team Executive Roundup - October 27-31, 2025](teams/intelligence/\[subteam]-mcp/weekly-reports/mcp-weekly-report-2025-10-31.md)
        * [MCP Tiger Team Executive Roundup - November 7th, 2025](teams/intelligence/\[subteam]-mcp/weekly-reports/mcp-weekly-report-2025-11-07.md)
        * [MCP Tiger Team Executive Roundup - November 14th, 2025](teams/intelligence/\[subteam]-mcp/weekly-reports/mcp-weekly-report-2025-11-14.md)
        * [MCP Tiger Team Executive Roundup - November 17th-21st, 2025](teams/intelligence/\[subteam]-mcp/weekly-reports/mcp-weekly-report-2025-11-21.md)
    * [\[subteam\]-semantic-data](teams/intelligence/subteam-semantic-data/README.md)
      * [weekly-reports](teams/intelligence/subteam-semantic-data/weekly-reports/README.md)
        * [Semantic Data Team Executive Roundup - June 30th - July 3rd 2025](teams/intelligence/\[subteam]-semantic-data/weekly-reports/semantic-data-weekly-report-2025-07-04.md)
        * [Semantic Data Team Executive Roundup - July 11, 2025](teams/intelligence/\[subteam]-semantic-data/weekly-reports/semantic-data-weekly-report-2025-07-11.md)
        * [Semantic Data Team Executive Roundup - July 18, 2025](teams/intelligence/\[subteam]-semantic-data/weekly-reports/semantic-data-weekly-report-2025-07-18.md)
        * [Semantic Data Team Executive Roundup - July 25, 2025](teams/intelligence/\[subteam]-semantic-data/weekly-reports/semantic-data-weekly-report-2025-07-25.md)
        * [Semantic Data Weekly Report - August 01, 2025](teams/intelligence/\[subteam]-semantic-data/weekly-reports/semantic-data-weekly-report-2025-08-01.md)
        * [Semantic Data Team Executive Roundup - August 22, 2025](teams/intelligence/\[subteam]-semantic-data/weekly-reports/semantic-data-weekly-report-2025-08-22.md)
        * [Semantic Data Team Executive Roundup - August 29, 2025](teams/intelligence/\[subteam]-semantic-data/weekly-reports/semantic-data-weekly-report-2025-08-29.md)
        * [Semantic Data Team Executive Roundup - September 5, 2025](teams/intelligence/\[subteam]-semantic-data/weekly-reports/semantic-data-weekly-report-2025-09-06.md)
        * [Semantic Data Team Executive Roundup - September 8-12, 2025](teams/intelligence/\[subteam]-semantic-data/weekly-reports/semantic-data-weekly-report-2025-09-12.md)
        * [Semantic Data Team Executive Roundup - September 19, 2025](teams/intelligence/\[subteam]-semantic-data/weekly-reports/semantic-data-weekly-report-2025-09-19.md)
        * [Semantic Data Team Executive Roundup - September 26, 2025](teams/intelligence/\[subteam]-semantic-data/weekly-reports/semantic-data-weekly-report-2025-09-26.md)
        * [Semantic Data Team Executive Roundup - October 3, 2025](teams/intelligence/\[subteam]-semantic-data/weekly-reports/semantic-data-weekly-report-2025-10-03.md)
        * [Semantic Data Team Executive Roundup - October 10, 2025](teams/intelligence/\[subteam]-semantic-data/weekly-reports/semantic-data-weekly-report-2025-10-10.md)
        * [Semantic Data Team Executive Roundup - October 17, 2025](teams/intelligence/\[subteam]-semantic-data/weekly-reports/semantic-data-weekly-report-2025-10-17.md)
        * [Semantic Data Team Executive Roundup - October 31, 2025](teams/intelligence/\[subteam]-semantic-data/weekly-reports/semantic-data-weekly-report-2025-10-31.md)
        * [Semantic Data Team Executive Roundup - November 7, 2025](teams/intelligence/\[subteam]-semantic-data/weekly-reports/semantic-data-weekly-report-2025-11-07.md)
        * [Semantic Data Team Executive Roundup - November 14, 2025](teams/intelligence/\[subteam]-semantic-data/weekly-reports/semantic-data-weekly-report-2025-11-14.md)
        * [Semantic Data Team Executive Roundup - November 21, 2025](teams/intelligence/\[subteam]-semantic-data/weekly-reports/semantic-data-weekly-report-2025-11-21.md)
    * [projects](teams/intelligence/projects/README.md)
      * [gtm-flow](teams/intelligence/projects/gtm-flow/README.md)
        * [GTM Flow: Narrative Positioning](teams/intelligence/projects/gtm-flow/gtm-flow-narrative-positioning.md)
        * [GTM Flow: Internal Positioning Memo](teams/intelligence/projects/gtm-flow/gtm-flow.md)
        * [Press Release: GTM Intelligence Engine](teams/intelligence/projects/gtm-flow/gtm-intelligence-engine-press-release.md)
        * [The Product Naming Playbook](teams/intelligence/projects/gtm-flow/naming.md)
    * [working\_docs](teams/intelligence/working_docs/README.md)
      * [rfcs](teams/intelligence/working_docs/rfcs/README.md)
        * [Natural Language Jupyter Notebooks for Data Enrichment](teams/intelligence/working_docs/rfcs/jupyter-audience.md)
  * [platform](teams/platform/README.md)
    * [\[subteam\]-admin](teams/platform/subteam-admin/README.md)
      * [weekly-reports](teams/platform/subteam-admin/weekly-reports/README.md)
        * [Brannen's Team Executive Roundup - 6/27/25](teams/platform/\[subteam]-admin/weekly-reports/admin-weekly-report-2025-06-27.md)
        * [Admin Weekly Report - July 04, 2025](teams/platform/\[subteam]-admin/weekly-reports/admin-weekly-report-2025-07-04.md)
        * [Admin Weekly Report - July 11, 2025](teams/platform/\[subteam]-admin/weekly-reports/admin-weekly-report-2025-07-11.md)
        * [B. Huske's Executive Roundup - 7/14/2025](teams/platform/\[subteam]-admin/weekly-reports/admin-weekly-report-2025-07-18.md)
        * [Admin Weekly Report - July 25, 2025](teams/platform/\[subteam]-admin/weekly-reports/admin-weekly-report-2025-07-25.md)
        * [Admin Weekly Report - August 01, 2025](teams/platform/\[subteam]-admin/weekly-reports/admin-weekly-report-2025-08-01.md)
        * [Admin Weekly Report - August 08, 2025](teams/platform/\[subteam]-admin/weekly-reports/admin-weekly-report-2025-08-08.md)
        * [Admin Weekly Report - August 15, 2025](teams/platform/\[subteam]-admin/weekly-reports/admin-weekly-report-2025-08-15.md)
        * [Admin Weekly Report - August 22, 2025](teams/platform/\[subteam]-admin/weekly-reports/admin-weekly-report-2025-08-22.md)
        * [Admin Weekly Report - August 29, 2025](teams/platform/\[subteam]-admin/weekly-reports/admin-weekly-report-2025-08-29.md)
        * [B. Huske's Executive Roundup - 9/1/2025](teams/platform/\[subteam]-admin/weekly-reports/admin-weekly-report-2025-09-06.md)
        * [Admin Weekly Report - October 31, 2025](teams/platform/\[subteam]-admin/weekly-reports/admin-weekly-report-2025-10-31.md)
        * [Admin Weekly Report - November 07, 2025](teams/platform/\[subteam]-admin/weekly-reports/admin-weekly-report-2025-11-07.md)
    * [\[subteam\]-automation](teams/platform/subteam-automation/README.md)
      * [weekly-reports](teams/platform/subteam-automation/weekly-reports/README.md)
        * [Automation Executive Roundup - 6/27/2025](teams/platform/\[subteam]-automation/weekly-reports/automation-weekly-report-2025-06-27.md)
        * [Automation Executive Roundup - 7/4/2025](teams/platform/\[subteam]-automation/weekly-reports/automation-weekly-report-2025-07-04.md)
        * [Automation Executive Roundup - 7/11/2025](teams/platform/\[subteam]-automation/weekly-reports/automation-weekly-report-2025-07-11.md)
        * [Automation Executive Roundup - 7/25/2025](teams/platform/\[subteam]-automation/weekly-reports/automation-weekly-report-2025-07-25.md)
        * [Automation Executive Roundup - 8/1/2025](teams/platform/\[subteam]-automation/weekly-reports/automation-weekly-report-2025-08-01.md)
        * [Automation Executive Roundup - 8/15/2025](teams/platform/\[subteam]-automation/weekly-reports/automation-weekly-report-2025-08-15.md)
        * [Automation Executive Roundup - 8/22/2025](teams/platform/\[subteam]-automation/weekly-reports/automation-weekly-report-2025-08-22.md)
        * [Automation Executive Roundup - 8/29/2025](teams/platform/\[subteam]-automation/weekly-reports/automation-weekly-report-2025-08-29.md)
        * [Automation Executive Roundup - 9/12/2025](teams/platform/\[subteam]-automation/weekly-reports/automation-weekly-report-2025-09-12.md)
        * [Automation Executive Roundup - 10/10/2025](teams/platform/\[subteam]-automation/weekly-reports/automation-weekly-report-2025-10-10.md)
        * [Automation Executive Roundup - 10/24/2025](teams/platform/\[subteam]-automation/weekly-reports/automation-weekly-report-2025-10-24.md)
        * [Automation Executive Roundup - 10/31/2025](teams/platform/\[subteam]-automation/weekly-reports/automation-weekly-report-2025-10-31.md)
        * [Automation Executive Roundup - 11/7/2025](teams/platform/\[subteam]-automation/weekly-reports/automation-weekly-report-2025-11-07.md)
        * [Automation Executive Roundup - 11/14/2025](teams/platform/\[subteam]-automation/weekly-reports/automation-weekly-report-2025-11-14.md)
        * [Automation Executive Roundup - 11/21/2025](teams/platform/\[subteam]-automation/weekly-reports/automation-weekly-report-2025-11-21.md)
    * [\[subteam\]-data-platform](teams/platform/subteam-data-platform/README.md)
      * [weekly-reports](teams/platform/subteam-data-platform/weekly-reports/README.md)
        * [Data Platform Team Executive Roundup - Week of 6/23/25](teams/platform/\[subteam]-data-platform/weekly-reports/data-platform-weekly-report-2025-06-27.md)
        * [Data Platform Team Executive Roundup - 6/30/25](teams/platform/\[subteam]-data-platform/weekly-reports/data-platform-weekly-report-2025-07-04.md)
        * [Data Platform Team Executive Roundup - w.o. 7/7/25](teams/platform/\[subteam]-data-platform/weekly-reports/data-platform-weekly-report-2025-07-11.md)
        * [Data Platform Team Executive Roundup - 7/14/25](teams/platform/\[subteam]-data-platform/weekly-reports/data-platform-weekly-report-2025-07-18.md)
        * [Data Platform Team Executive Roundup - 7/21/25](teams/platform/\[subteam]-data-platform/weekly-reports/data-platform-weekly-report-2025-07-25.md)
        * [Data Platform Team Executive Roundup - Week of 7/28/2025](teams/platform/\[subteam]-data-platform/weekly-reports/data-platform-weekly-report-2025-08-01.md)
        * [M. Delurgio Team Executive Roundup -- August 4--8, 2025](teams/platform/\[subteam]-data-platform/weekly-reports/data-platform-weekly-report-2025-08-08.md)
        * [Data Platform Team Executive Roundup - August 15, 2025](teams/platform/\[subteam]-data-platform/weekly-reports/data-platform-weekly-report-2025-08-15.md)
        * [Data Platform Team Executive Roundup - 8/22/25](teams/platform/\[subteam]-data-platform/weekly-reports/data-platform-weekly-report-2025-08-22.md)
        * [Data Platform Team Executive Roundup - 8/30/25](teams/platform/\[subteam]-data-platform/weekly-reports/data-platform-weekly-report-2025-08-29.md)
        * [GTM Data Platform Team Executive Roundup - Week of 9/1/2025](teams/platform/\[subteam]-data-platform/weekly-reports/data-platform-weekly-report-2025-09-06.md)
        * [Data Platform Team Executive Roundup - September 8, 2025](teams/platform/\[subteam]-data-platform/weekly-reports/data-platform-weekly-report-2025-09-12.md)
        * [Data Platform Team Executive Roundup - September 19, 2025](teams/platform/\[subteam]-data-platform/weekly-reports/data-platform-weekly-report-2025-09-19.md)
        * [GTM Data Platform Weekly Report - September 26, 2025](teams/platform/\[subteam]-data-platform/weekly-reports/data-platform-weekly-report-2025-09-26.md)
        * [Data Platform Team Executive Roundup - September 26, 2025](teams/platform/\[subteam]-data-platform/weekly-reports/data-platform-weekly-report-2025-10-03.md)
        * [Data Platform Executive Roundup - Week of October 6, 2025](teams/platform/\[subteam]-data-platform/weekly-reports/data-platform-weekly-report-2025-10-10.md)
        * [GTM Data Platform Executive Roundup - Week of October 13, 2025](teams/platform/\[subteam]-data-platform/weekly-reports/data-platform-weekly-report-2025-10-17.md)
        * [Data Platform Executive Roundup - Week of October 20, 2025](teams/platform/\[subteam]-data-platform/weekly-reports/data-platform-weekly-report-2025-10-24.md)
        * [Data Platform Executive Roundup - Week of October 27, 2025](teams/platform/\[subteam]-data-platform/weekly-reports/data-platform-weekly-report-2025-10-31.md)
        * [Data Platform Executive Roundup - November 7, 2025](teams/platform/\[subteam]-data-platform/weekly-reports/data-platform-weekly-report-2025-11-07.md)
        * [Data Platform Team Executive Roundup - Week of November 10, 2025](teams/platform/\[subteam]-data-platform/weekly-reports/data-platform-weekly-report-2025-11-14.md)
        * [Data Platform Executive Roundup - November 21, 2025](teams/platform/\[subteam]-data-platform/weekly-reports/data-platform-weekly-report-2025-11-21.md)
    * [\[subteam\]-integrations](teams/platform/subteam-integrations/README.md)
      * [weekly-reports](teams/platform/subteam-integrations/weekly-reports/README.md)
        * [Integrations Team Executive Roundup - Week of 20250623](teams/platform/\[subteam]-integrations/weekly-reports/integrations-weekly-report-2025-06-27.md)
        * [Integrations Executive Roundup - Week of July 7, 2025](teams/platform/\[subteam]-integrations/weekly-reports/integrations-weekly-report-2025-07-11.md)
        * [Integrations Team Executive Roundup](teams/platform/\[subteam]-integrations/weekly-reports/integrations-weekly-report-2025-07-18.md)
        * [Integrations Weekly Report - July 25, 2025](teams/platform/\[subteam]-integrations/weekly-reports/integrations-weekly-report-2025-07-25.md)
        * [Integrations Executive Roundup - Week of August 4, 2025](teams/platform/\[subteam]-integrations/weekly-reports/integrations-weekly-report-2025-08-08.md)
        * [Integrations Executive Roundup - Week of August 11, 2025](teams/platform/\[subteam]-integrations/weekly-reports/integrations-weekly-report-2025-08-15.md)
        * [Integrations Weekly Report - August 22, 2025](teams/platform/\[subteam]-integrations/weekly-reports/integrations-weekly-report-2025-08-22.md)
        * [\[Integrations Executive Roundup - \[8/25/25\]](teams/platform/\[subteam]-integrations/weekly-reports/integrations-weekly-report-2025-08-29.md)
        * [Integrations Team Executive Roundup](teams/platform/\[subteam]-integrations/weekly-reports/integrations-weekly-report-2025-09-06.md)
        * [Integrations Team Executive Roundup - Week of September 8, 2025](teams/platform/\[subteam]-integrations/weekly-reports/integrations-weekly-report-2025-09-12.md)
        * [Integrations Weekly Report - September 19, 2025](teams/platform/\[subteam]-integrations/weekly-reports/integrations-weekly-report-2025-09-19.md)
        * [Integrations Executive Roundup - September 22, 2025](teams/platform/\[subteam]-integrations/weekly-reports/integrations-weekly-report-2025-09-26.md)
        * [Integrations Executive Roundup - Week of September 29, 2025](teams/platform/\[subteam]-integrations/weekly-reports/integrations-weekly-report-2025-10-03.md)
        * [Integrations Team Executive Roundup - October 6, 2025](teams/platform/\[subteam]-integrations/weekly-reports/integrations-weekly-report-2025-10-10.md)
        * [Integrations Executive Roundup - Week of October 13, 2025](teams/platform/\[subteam]-integrations/weekly-reports/integrations-weekly-report-2025-10-17.md)
        * [Integrations Executive Roundup - October 20, 2025](teams/platform/\[subteam]-integrations/weekly-reports/integrations-weekly-report-2025-10-24.md)
        * [Integrations Team Executive Roundup - October 27, 2025](teams/platform/\[subteam]-integrations/weekly-reports/integrations-weekly-report-2025-10-31.md)
        * [Integrations Team Executive Roundup - Week of Nov 3, 2025](teams/platform/\[subteam]-integrations/weekly-reports/integrations-weekly-report-2025-11-07.md)
        * [Integrations Team Executive Roundup](teams/platform/\[subteam]-integrations/weekly-reports/integrations-weekly-report-2025-11-14.md)
        * [Integrations Team Executive Roundup - Week of Nov 17, 2025](teams/platform/\[subteam]-integrations/weekly-reports/integrations-weekly-report-2025-11-21.md)
    * [\[subteam\]-zim](teams/platform/subteam-zim/README.md)
      * [weekly-reports](teams/platform/subteam-zim/weekly-reports/README.md)
        * [ZIM Team Executive Roundup - Week of June 27, 2025](teams/platform/\[subteam]-zim/weekly-reports/zim-weekly-report-2025-06-27.md)
        * [ZIM Team Executive Roundup - Week of June 30, 2025](teams/platform/\[subteam]-zim/weekly-reports/zim-weekly-report-2025-07-04.md)
        * [ZIM Team Executive Roundup - Week of July 7, 2025](teams/platform/\[subteam]-zim/weekly-reports/zim-weekly-report-2025-07-11.md)
        * [Anwar's Team Executive Roundup - Week of July 14, 2025](teams/platform/\[subteam]-zim/weekly-reports/zim-weekly-report-2025-07-18.md)
        * [ZIM Team Executive Roundup - Week of July 21, 2025](teams/platform/\[subteam]-zim/weekly-reports/zim-weekly-report-2025-07-25.md)
        * [ZIM Team Executive Roundup - Week of July 28, 2025](teams/platform/\[subteam]-zim/weekly-reports/zim-weekly-report-2025-08-01.md)
        * [ZIM Team Executive Roundup - Week of August 4, 2025](teams/platform/\[subteam]-zim/weekly-reports/zim-weekly-report-2025-08-08.md)
        * [ZIM Team Executive Roundup - Week of August 11, 2025](teams/platform/\[subteam]-zim/weekly-reports/zim-weekly-report-2025-08-15.md)
        * [ZIM Team Executive Roundup - Week of August 18, 2025](teams/platform/\[subteam]-zim/weekly-reports/zim-weekly-report-2025-08-22.md)
        * [ZIM Team Executive Roundup - Week of August 25, 2025](teams/platform/\[subteam]-zim/weekly-reports/zim-weekly-report-2025-08-29.md)
        * [ZIM Team Executive Roundup - Week of September 1, 2025](teams/platform/\[subteam]-zim/weekly-reports/zim-weekly-report-2025-09-06.md)
        * [ZIM Team Executive Roundup - Week of September 8, 2025](teams/platform/\[subteam]-zim/weekly-reports/zim-weekly-report-2025-09-12.md)
        * [ZIM Team Executive Roundup - Week of September 15, 2025](teams/platform/\[subteam]-zim/weekly-reports/zim-weekly-report-2025-09-19.md)
        * [ZIM Team Executive Roundup - Week of September 22, 2025](teams/platform/\[subteam]-zim/weekly-reports/zim-weekly-report-2025-09-26.md)
        * [ZIM Team Executive Roundup - Week of September 29, 2025](teams/platform/\[subteam]-zim/weekly-reports/zim-weekly-report-2025-10-03.md)
        * [ZIM Team Executive Roundup - Week of October 6, 2025](teams/platform/\[subteam]-zim/weekly-reports/zim-weekly-report-2025-10-10.md)
        * [ZIM Team Executive Roundup - Week of October 13, 2025](teams/platform/\[subteam]-zim/weekly-reports/zim-weekly-report-2025-10-17.md)
        * [ZIM Team Executive Roundup - Week of October 20, 2025](teams/platform/\[subteam]-zim/weekly-reports/zim-weekly-report-2025-10-24.md)
        * [ZIM Team Executive Roundup - Week of October 27, 2025](teams/platform/\[subteam]-zim/weekly-reports/zim-weekly-report-2025-10-31.md)
        * [ZIM Team Executive Roundup - Week of November 3, 2025](teams/platform/\[subteam]-zim/weekly-reports/zim-weekly-report-2025-11-07.md)
        * [ZIM Team Executive Roundup - Week of November 10, 2025](teams/platform/\[subteam]-zim/weekly-reports/zim-weekly-report-2025-11-14.md)
